id,institutionCode,collectionCode,ownerInstitutionCode,basisOfRecord,occurrenceID,catalogNumber,otherCatalogNumbers,kingdom,phylum,class,order,family,scientificName,taxonID,scientificNameAuthorship,genus,specificEpithet,taxonRank,infraspecificEpithet,identifiedBy,dateIdentified,identificationReferences,identificationRemarks,taxonRemarks,identificationQualifier,typeStatus,recordedBy,associatedCollectors,recordNumber,eventDate,year,month,day,startDayOfYear,endDayOfYear,verbatimEventDate,occurrenceRemarks,habitat,substrate,verbatimAttributes,fieldNumber,informationWithheld,dataGeneralizations,dynamicProperties,associatedTaxa,reproductiveCondition,establishmentMeans,cultivationStatus,lifeStage,sex,individualCount,preparations,country,stateProvince,county,municipality,locality,locationRemarks,localitySecurity,localitySecurityReason,decimalLatitude,decimalLongitude,geodeticDatum,coordinateUncertaintyInMeters,verbatimCoordinates,georeferencedBy,georeferenceProtocol,georeferenceSources,georeferenceVerificationStatus,georeferenceRemarks,minimumElevationInMeters,maximumElevationInMeters,minimumDepthInMeters,maximumDepthInMeters,verbatimDepth,verbatimElevation,disposition,language,recordEnteredBy,modified,sourcePrimaryKey-dbpk,collId,recordId,references
7924749,NCU,,,PreservedSpecimen,140a52a3-8380-4388-b0fb-9b271d8a619b,NCU00077228,219373,Plantae,Magnoliophyta,,Poales,Poaceae,Andropogon glomeratus var. pumilus ,14575,(Nash) Nash,Andropogon,glomeratus,var.,pumilus ,"Sorrie, Bruce A.",2015,,"""Synonym = Andropogon glomeratus (Walter) B.S.P. var. pumilus Vasey""",,,,"Jones, Samuel B.",,s. n.,9/26/59,1959,9,26,269,,,,Old field,,,,,,,,,,,,,,,United States,Alabama,Lee,,Old field near Auburn,,,,32.6011835,-85.3556116,,,,,,,,,,,,,,,,en,Philip Straughn,5/30/16 14:40,,206,urn:uuid:140a52a3-8380-4388-b0fb-9b271d8a619b,http://sernecportal.org/portal/collections/individual/index.php?occid=7924749
7924752,NCU,,,PreservedSpecimen,03b89729-c114-46cf-b561-955ae15a7158,NCU00077229,379196,Plantae,Magnoliophyta,,Poales,Poaceae,Andropogon glomeratus var. pumilus ,14575,(Nash) Nash,Andropogon,glomeratus,var.,pumilus ,"Sorrie, Bruce A.",2015,,"""Synonym = Andropogon glomeratus (Walter) B.S.P. var. pumilus Vasey""",,,,"Gregory, J. M.",,164,5/9/69,1969,5,9,129,,,,Old field; common,,,,,,,,,,,,,,,United States,Alabama,Macon,,Tuskegee National Forest south of Auburn.,,,,32.38602298,-85.69260662,,,,,,,,,,,,,,,,en,Philip Straughn,5/26/16 17:31,,206,urn:uuid:03b89729-c114-46cf-b561-955ae15a7158,http://sernecportal.org/portal/collections/individual/index.php?occid=7924752
7924754,NCU,,,PreservedSpecimen,08dcd7d1-948a-4c55-a922-3243829ca0e2,NCU00077230,346605,Plantae,Magnoliophyta,,Poales,Poaceae,Andropogon glomeratus var. pumilus ,14575,(Nash) Nash,Andropogon,glomeratus,var.,pumilus ,"Sorrie, Bruce A.",2015,,"""Synonym = Andropogon glomeratus (Walter) B.S.P. var. pumilus Vasey""",,,,"Lelong, Michel G.",,3816.1,10/3/67,1967,10,3,276,,,,"Moist, sandy soil",,,,,,,"Cyrilla racemiflora, Ilex coriacea, Ilex glabra, Rhus vernix, red maple.",,,,,,,,United States,Alabama,Mobile,,"Mobile Co., Alabama. N.E. 1/4 of N.E. 1/4 of Section 16; T.4S, R.2W. along southeast bank of Three Mile Creek. University of South Alabama Property, Mobile.",,,,30.79425792,-88.20178987,,,,,,,,,,,,,,,,en,Philip Straughn,5/30/16 14:50,,206,urn:uuid:08dcd7d1-948a-4c55-a922-3243829ca0e2,http://sernecportal.org/portal/collections/individual/index.php?occid=7924754
7924757,NCU,,,PreservedSpecimen,4d9fdd85-c2a3-4bd5-92d2-0f6459db08a3,NCU00077232,429401,Plantae,Magnoliophyta,,Poales,Poaceae,Andropogon glomeratus var. pumilus ,14575,(Nash) Nash,Andropogon,glomeratus,var.,pumilus ,"Sorrie, Bruce A.",2015,,"""Synonym = Andropogon glomeratus (Walter) B.S.P. var. pumilus Vasey""",,,,"Deramus, Rebecca",,D817,11/6/65,1965,11,6,310,,11/6/65,,,,Very common,,,,,,,,,,,,,United States,Alabama,Mobile,,South of state lab (AM. R. L.) Roadside area,,,,30.79425792,-88.20178987,,,,,,,,,,,,,,,,en,Philip Straughn,5/30/16 14:42,,206,urn:uuid:4d9fdd85-c2a3-4bd5-92d2-0f6459db08a3,http://sernecportal.org/portal/collections/individual/index.php?occid=7924757
7924762,NCU,,,PreservedSpecimen,b05dda6f-d773-4666-8d03-5a04b70796a2,NCU00077233,256617,Plantae,Magnoliophyta,,Poales,Poaceae,Andropogon glomeratus var. pumilus ,14575,(Nash) Nash,Andropogon,glomeratus,var.,pumilus ,"Sorrie, Bruce A.",2015,,"""Synonym = Andropogon glomeratus (Walter) B.S.P. var. pumilus Vasey""",,,,"Jones, Samuel B.",,1730,9/6/63,1963,9,6,249,,,,Open cleared area.,,,,,,,,,,,,,,,United States,Alabama,Sumter,,6 mi. N of York at RR crossing on hwy. 17. Open cleared area.,,,,32.59102899,-88.19879817,,,,,,,,,,,,,,,,en,Philip Straughn,5/30/16 18:57,,206,urn:uuid:b05dda6f-d773-4666-8d03-5a04b70796a2,http://sernecportal.org/portal/collections/individual/index.php?occid=7924762
7924768,NCU,,,PreservedSpecimen,d5f40a0a-97a4-428b-9722-df32fcae173d,NCU00077500,274677,Plantae,Magnoliophyta,,Poales,Poaceae,Andropogon glomeratus var. pumilus ,14575,(Nash) Nash,Andropogon,glomeratus,var.,pumilus ,"Sorrie, Bruce A.",2015,,"""Synonym = Andropogon glomeratus (Walter) B.S.P. var. pumilus Vasey""",,,,"Stimson, William R.",,852,8/22/64,1964,8,22,235,,,,,,,,,,,,,,,,,,,United States,Florida,Broward,,Along elevated gravel road in open swamp a mile or so north of Andytown,,,,26.15191486,-80.48856796,,,,,,,,,,,,,,,,en,Philip Straughn,5/30/16 15:05,,206,urn:uuid:d5f40a0a-97a4-428b-9722-df32fcae173d,http://sernecportal.org/portal/collections/individual/index.php?occid=7924768
7924771,NCU,,,PreservedSpecimen,d4c6bdef-5859-4653-8029-6f0e9ea29fbe,NCU00077601,233925,Plantae,Magnoliophyta,,Poales,Poaceae,Andropogon glomeratus var. pumilus ,14575,(Nash) Nash,Andropogon,glomeratus,var.,pumilus ,"Sorrie, Bruce A.",2015,,"""Synonym = Andropogon glomeratus (Walter) B.S.P. var. pumilus Vasey""",,,,"Lakela, O.",,24675,9/29/61,1961,9,29,272,,,,"Flat pineland meadow, seasonally dry",,Abundant in conspicuous tufts.,,,,,"Lachnanthes, Eriocaulon",,,,,,,,United States,Florida,Charlotte,,Near Murdock off US 41.,,,,26.90685875,-81.89399418,,,,,,,,,,,,,,,,en,Philip Straughn,5/30/16 14:57,,206,urn:uuid:d4c6bdef-5859-4653-8029-6f0e9ea29fbe,http://sernecportal.org/portal/collections/individual/index.php?occid=7924771
7924772,NCU,,,PreservedSpecimen,903338cb-bc7d-4ff1-a6cc-511144ad5f51,NCU00077602,419081,Plantae,Magnoliophyta,,Poales,Poaceae,Andropogon glomeratus var. pumilus ,14575,(Nash) Nash,Andropogon,glomeratus,var.,pumilus ,"Sorrie, Bruce A.",2015,,"""Synonym = Andropogon glomeratus (Walter) B.S.P. var. pumilus Vasey""",,,,"Radford, A. E.","Leonard, S. W.",45654,10/16/69,1969,10,16,289,,,,Pine savannah,,,,,,,,,,,,,,,United States,Florida,Collier,,"near US 41, 4.8 miles north of Bonita Springs.",,,,26.11957426,-81.3392833,,,,,,,,,,,,,,,,en,Philip Straughn,5/30/16 15:03,,206,urn:uuid:903338cb-bc7d-4ff1-a6cc-511144ad5f51,http://sernecportal.org/portal/collections/individual/index.php?occid=7924772
7924776,NCU,,,PreservedSpecimen,5fca3317-8116-4d6e-b006-720c78d22141,NCU00077604,523420,Plantae,Magnoliophyta,,Poales,Poaceae,Andropogon glomeratus var. pumilus ,14575,(Nash) Nash,Andropogon,glomeratus,var.,pumilus ,"Sorrie, Bruce A.",2015,,"""Synonym = Andropogon glomeratus (Walter) B.S.P. var. pumilus Vasey""",,,,"Campbell, C. S.",,3731,9/9/77,1977,9,9,252,,,,,,,,,,,,,,,,,,,United States,Florida,Miami Dade,,"Flora of Dade Co., Florida, vacant lot, Homestead",,,,25.6171109,-80.56822009,,,,,,,,,,,,,,,,en,Philip Straughn,5/30/16 15:00,,206,urn:uuid:5fca3317-8116-4d6e-b006-720c78d22141,http://sernecportal.org/portal/collections/individual/index.php?occid=7924776
7924778,NCU,,,PreservedSpecimen,388b0ce7-6516-4990-9861-9649655aa572,NCU00077605,427276,Plantae,Magnoliophyta,,Poales,Poaceae,Andropogon glomeratus var. pumilus ,14575,(Nash) Nash,Andropogon,glomeratus,var.,pumilus ,"Sorrie, Bruce A.",2015,,"""Synonym = Andropogon glomeratus (Walter) B.S.P. var. pumilus Vasey""",,,,"Godfrey, R. K.",,72115,9/15/72,1972,9,15,259,,,,Old field,,,,,,,,,,,,,,,United States,Florida,Miami Dade,,"Old field, Homestead.",,,,25.6171109,-80.56822009,,,,,,,,,,,,,,,,en,Philip Straughn,5/30/16 18:55,,206,urn:uuid:388b0ce7-6516-4990-9861-9649655aa572,http://sernecportal.org/portal/collections/individual/index.php?occid=7924778
7924781,NCU,,,PreservedSpecimen,c344846d-b759-4207-89d6-631b9d07f4af,NCU00077606,182375,Plantae,Magnoliophyta,,Poales,Poaceae,Andropogon glomeratus var. pumilus ,14575,(Nash) Nash,Andropogon,glomeratus,var.,pumilus ,"Sorrie, Bruce A.",2015,,"""Synonym = Andropogon glomeratus (Walter) B.S.P. var. pumilus Vasey""",,,,"Craighead, F. C.",,12,11/10/59,1959,11,10,314,,,,,,,,,,,,,,,,,,,United States,Florida,Miami Dade,,Flooded glades north of Long Pine Key,,,,25.6171109,-80.56822009,,,,,,,,,,,,,,,,en,Philip Straughn,5/30/16 18:51,,206,urn:uuid:c344846d-b759-4207-89d6-631b9d07f4af,http://sernecportal.org/portal/collections/individual/index.php?occid=7924781
7924783,NCU,,,PreservedSpecimen,f4761d12-d3e5-49d9-8e23-42e2362bd292,NCU00077608,493083,Plantae,Magnoliophyta,,Poales,Poaceae,Andropogon glomeratus var. pumilus ,14575,(Nash) Nash,Andropogon,glomeratus,var.,pumilus ,"Sorrie, Bruce A.",2015,,"""Synonym = Andropogon glomeratus (Walter) B.S.P. var. pumilus Vasey""",,,,"Correll, D. S.","Popenoe, John",50100,8/26/78,1978,8,26,238,,,,,,In large clumps,,,,,,,,,,,,,United States,Florida,Miami Dade,,"Deering Estate, Cutler, in moist open area on edge of pinelands.",,,,25.6171109,-80.56822009,,,,,,,,,,,,,,,,en,Philip Straughn,5/30/16 15:09,,206,urn:uuid:f4761d12-d3e5-49d9-8e23-42e2362bd292,http://sernecportal.org/portal/collections/individual/index.php?occid=7924783
7924787,NCU,,,PreservedSpecimen,237e7fdb-6c65-4303-a5aa-23cc758d924d,NCU00077611,16578,Plantae,Magnoliophyta,,Poales,Poaceae,Andropogon glomeratus var. pumilus ,14575,(Nash) Nash,Andropogon,glomeratus,var.,pumilus ,"Sorrie, Bruce A.",2015-00-00,,Synonym = Andropogon glomeratus (Walter) B.S.P. var. pumilus Vasey,,,,"Curtiss, Allen Hiram",,6078,1897-11-01,1897,11,1,305,,,,Low ground bordering river,,,,,,,,,,,,,,,United States,Florida,Duval,,"near Jacksonville, Florida",,,,30.33021564,-81.6739749,WGS84,41862,,"McCormick, Carol Ann",,GeoLocate,,#NAME?,,,,,,,,en,Philip Straughn,7/19/16 15:07,,206,urn:uuid:237e7fdb-6c65-4303-a5aa-23cc758d924d,http://sernecportal.org/portal/collections/individual/index.php?occid=7924787
7924791,NCU,,,PreservedSpecimen,03274718-dcd0-410f-8f5b-908c887861fd,NCU00077612,293982,Plantae,Magnoliophyta,,Poales,Poaceae,Andropogon glomeratus var. pumilus ,14575,(Nash) Nash,Andropogon,glomeratus,var.,pumilus ,"Sorrie, Bruce A.",2015,,"""Synonym = Andropogon glomeratus (Walter) B.S.P. var. pumilus Vasey""",,,,,,,,,,,,,,,,,,,,,,,,,,,,,,United States,Florida,Escambia,,,,,,30.70118997,-87.37767989,,,,,,,,,,,,,,,,en,Philip Straughn,7/1/16 13:19,,206,urn:uuid:03274718-dcd0-410f-8f5b-908c887861fd,http://sernecportal.org/portal/collections/individual/index.php?occid=7924791
7924795,NCU,,,PreservedSpecimen,a633028d-da3f-4817-942b-79064418662e,NCU00077613,178078,Plantae,Magnoliophyta,,Poales,Poaceae,Andropogon glomeratus var. pumilus ,14575,(Nash) Nash,Andropogon,glomeratus,var.,pumilus ,"Sorrie, Bruce A.",2015,,"""Synonym = Andropogon glomeratus (Walter) B.S.P. var. pumilus Vasey""",,,,"Cooley, George R.","Eaton, Richard J.; Ray, Jr., James D.",7078,9/19/59,1959,9,19,262,,,,,,,,,,,,,,,,,,,United States,Florida,Hernando,,"Hernando County, north of Highway 98 in hammock. Section 13, T21S, R18E.",,,,28.55281051,-82.42093518,,,,,,,,,,,,,,,,en,Philip Straughn,5/30/16 17:42,,206,urn:uuid:a633028d-da3f-4817-942b-79064418662e,http://sernecportal.org/portal/collections/individual/index.php?occid=7924795
7924797,NCU,,,PreservedSpecimen,9720b3fa-864a-4e6c-8027-d4929396259a,NCU00077614,258119,Plantae,Magnoliophyta,,Poales,Poaceae,Andropogon glomeratus var. pumilus ,14575,(Nash) Nash,Andropogon,glomeratus,var.,pumilus ,"Sorrie, Bruce A.",2015,,"""Synonym = Andropogon glomeratus (Walter) B.S.P. var. pumilus Vasey""",,,,"Perdue, Jr., Robert E.",,1748,9/16/54,1954,9,16,259,,,,Up to 4 feet high.,,,,,,,,,,,,,,,United States,Florida,Hillsborough,,"Hillsboro Co.: old field near highway, Route 41, sandy loam, 6.5 miles north of Ruskin.",,,,27.93055626,-82.3072041,,,,,,,,,,,,,,,,en,Philip Straughn,5/30/16 15:14,,206,urn:uuid:9720b3fa-864a-4e6c-8027-d4929396259a,http://sernecportal.org/portal/collections/individual/index.php?occid=7924797
7924801,NCU,,,PreservedSpecimen,a7e93db8-d574-4b4c-ac62-3ee1044e6742,NCU00077620,462853,Plantae,Magnoliophyta,,Poales,Poaceae,Andropogon glomeratus var. pumilus ,14575,(Nash) Nash,Andropogon,glomeratus,var.,pumilus ,"Sorrie, Bruce A.",2015,,"""Synonym = Andropogon glomeratus (Walter) B.S.P. var. pumilus Vasey""",,,,"Godfrey, R. K.",,74115,11/20/74,1974,11,20,324,,,,,,,,,,,,,,,,,,,United States,Florida,Madison,,"Abundant in swale bordering cypress-gum pond, 3 miles W of Greenville.",,,,30.44416899,-83.47000462,,,,,,,,,,,,,,,,en,Philip Straughn,5/30/16 15:17,,206,urn:uuid:a7e93db8-d574-4b4c-ac62-3ee1044e6742,http://sernecportal.org/portal/collections/individual/index.php?occid=7924801
7924804,NCU,,,PreservedSpecimen,702f1e28-fe88-4f33-b087-f00a25148a34,NCU00077622,258122,Plantae,Magnoliophyta,,Poales,Poaceae,Andropogon glomeratus var. pumilus ,14575,(Nash) Nash,Andropogon,glomeratus,var.,pumilus ,"Sorrie, Bruce A.",2015,,"""Synonym = Andropogon glomeratus (Walter) B.S.P. var. pumilus Vasey""",,,,"Perdue, Jr., Robert E.",,1788,9/18/54,1954,9,18,261,,,,,,,,,,,,,,,,,,,United States,Florida,Madison,,"Manatee Co.: Anna Maria, in pure sand in open areas among palms.",,,,30.44416899,-83.47000462,,,,,,,,,,,,,,,,en,Philip Straughn,5/30/16 17:39,,206,urn:uuid:702f1e28-fe88-4f33-b087-f00a25148a34,http://sernecportal.org/portal/collections/individual/index.php?occid=7924804
7924808,NCU,,,PreservedSpecimen,c3fa26ab-1a81-4c71-b3bd-cf10fdc50bdd,NCU00077624,427199,Plantae,Magnoliophyta,,Poales,Poaceae,Andropogon glomeratus var. pumilus ,14575,(Nash) Nash,Andropogon,glomeratus,var.,pumilus ,"Sorrie, Bruce A.",2015,,"""Synonym = Andropogon glomeratus (Walter) B.S.P. var. pumilus Vasey""",,,,"Godfrey, R. K.",,72126,9/16/72,1972,9,16,260,,,,,,,,,,,,,,,,,,,United States,Florida,Monroe,,"Common at the edges of mangroves along shores, Rockland Key.",,,,,,,,,,,,,,,,,,,,,en,Philip Straughn,5/30/16 15:20,,206,urn:uuid:c3fa26ab-1a81-4c71-b3bd-cf10fdc50bdd,http://sernecportal.org/portal/collections/individual/index.php?occid=7924808
7924823,NCU,,,PreservedSpecimen,c94a36e3-d444-4185-a394-e7d8acbcd36e,NCU00078843,480472,Plantae,Magnoliophyta,,Poales,Poaceae,Andropogon glomeratus var. pumilus ,14575,(Nash) Nash,Andropogon,glomeratus,var.,pumilus ,"Sorrie, Bruce A.",2015,,"""Synonym = Andropogon glomeratus (Walter) B.S.P. var. pumilus Vasey""",,,,"Godfrey, R. K.",,74715,10/24/75,1975,10,24,297,,,,,,Very abundant,,,,,,,,,,,,,United States,Florida,Nassau,,"wax myrtle flats, St. Augustine Beach.",,,,30.60951418,-81.80848437,,,,,,,,,,,,,,,,en,Philip Straughn,5/30/16 17:38,,206,urn:uuid:c94a36e3-d444-4185-a394-e7d8acbcd36e,http://sernecportal.org/portal/collections/individual/index.php?occid=7924823
7924831,NCU,,,PreservedSpecimen,122260dd-1c9e-4b35-bdde-fd81e624a1cb,NCU00077625,296140,Plantae,Magnoliophyta,,Poales,Poaceae,Andropogon glomeratus var. pumilus ,14575,(Nash) Nash,Andropogon,glomeratus,var.,pumilus ,"Sorrie, Bruce A.",2015,,"""Synonym = Andropogon glomeratus (Walter) B.S.P. var. pumilus Vasey""",,,,"Cassen, Paul M.",,40,10/25/66,1966,10,25,298,,,,,,,,,,,,,,,,,,,United States,Florida,Palm Beach,,Drehev Park.,,,,26.6230049,-80.43291035,,,,,,,,,,,,,,,,en,Philip Straughn,5/30/16 17:35,,206,urn:uuid:122260dd-1c9e-4b35-bdde-fd81e624a1cb,http://sernecportal.org/portal/collections/individual/index.php?occid=7924831
7924833,NCU,,,PreservedSpecimen,c313965a-6bb6-47a3-9ed8-a06aa938e246,NCU00077626,408805,Plantae,Magnoliophyta,,Poales,Poaceae,Andropogon glomeratus var. pumilus ,14575,(Nash) Nash,Andropogon,glomeratus,var.,pumilus ,"Sorrie, Bruce A.",2015,,"""Synonym = Andropogon glomeratus (Walter) B.S.P. var. pumilus Vasey""",,,,"Cassen, Paul M.",,455,11/30/68,1968,11,30,335,,,,Growing in wet sand and muck on the edge of a water storage area.,,Frequent,,,,,,,,,,,,,United States,Florida,Palm Beach,,"Around the bend from the Shrine Club, on the north side of Old Okeechobee Road, West Palm Beach.",,,,26.6230049,-80.43291035,,,,,,,,,,,,,,,,en,Philip Straughn,5/30/16 15:22,,206,urn:uuid:c313965a-6bb6-47a3-9ed8-a06aa938e246,http://sernecportal.org/portal/collections/individual/index.php?occid=7924833
7924835,NCU,,,PreservedSpecimen,25cfd9c0-268b-47c0-962a-a39b35c62761,NCU00077628,423135,Plantae,Magnoliophyta,,Poales,Poaceae,Andropogon glomeratus var. pumilus ,14575,(Nash) Nash,Andropogon,glomeratus,var.,pumilus ,"Sorrie, Bruce A.",2015,,"""Synonym = Andropogon glomeratus (Walter) B.S.P. var. pumilus Vasey""",,,,"Bell, Ritchie C.",,17357,12/6/62,1962,12,6,340,,,,Cypress swamp and swamp margins,,,,,,,,,,,,,,,United States,Florida,Polk,,Cypress swamp and swamp margins of American Cyanamid Orange Park mine lands ca. 7 miles north of Lakeland to the west of Fla. Hwy. 33.,,,,27.94887707,-81.69775899,,,,,,,,,,,,,,,,en,Philip Straughn,5/30/16 16:43,,206,urn:uuid:25cfd9c0-268b-47c0-962a-a39b35c62761,http://sernecportal.org/portal/collections/individual/index.php?occid=7924835
7924837,NCU,,,PreservedSpecimen,6243dc26-fbdf-4c08-97dd-b8fe194a3b6e,NCU00077629,194354,Plantae,Magnoliophyta,,Poales,Poaceae,Andropogon glomeratus var. pumilus ,14575,(Nash) Nash,Andropogon,glomeratus,var.,pumilus ,"Sorrie, Bruce A.",2015,,"""Synonym = Andropogon glomeratus (Walter) B.S.P. var. pumilus Vasey""",,,,"Ward, D. B.","Ward, S. S.",2305,10/18/60,1960,10,18,292,,,,in moist soil between road and railroad.,,1 m. tall; common,,,,,,,,,,,,,United States,Florida,Saint Johns,,"in moist soil between road and railroad, n. side of Hastings, sec. 8, T 9 S, R 28 E, St. Johns County, Florida",,,,29.90131197,-81.44387866,,,,,,,,,,,,,,,,en,Philip Straughn,5/30/16 16:48,,206,urn:uuid:6243dc26-fbdf-4c08-97dd-b8fe194a3b6e,http://sernecportal.org/portal/collections/individual/index.php?occid=7924837
7924838,NCU,,,PreservedSpecimen,d310096f-c137-4b89-979a-e1590f62e89e,NCU00077630,461804,Plantae,Magnoliophyta,,Poales,Poaceae,Andropogon glomeratus var. pumilus ,14575,(Nash) Nash,Andropogon,glomeratus,var.,pumilus ,"Sorrie, Bruce A.",2015,,"""Synonym = Andropogon glomeratus (Walter) B.S.P. var. pumilus Vasey""",,,,"Godfrey, R. K.",,74145,11/22/74,1974,11,22,326,,,,Common on banks of marshes,,Plants not glaucous.,,,,,,,,,,,,,United States,Florida,Taylor,,Steinhatchee.,,,,30.04767096,-83.60300797,,,,,,,,,,,,,,,,en,Philip Straughn,5/30/16 16:45,,206,urn:uuid:d310096f-c137-4b89-979a-e1590f62e89e,http://sernecportal.org/portal/collections/individual/index.php?occid=7924838
7924840,NCU,,,PreservedSpecimen,fe3c021f-7c74-4071-b426-41dff0706917,NCU00077631,106482,Plantae,Magnoliophyta,,Poales,Poaceae,Andropogon glomeratus var. pumilus ,14575,(Nash) Nash,Andropogon,glomeratus,var.,pumilus ,"Sorrie, Bruce A.",2015,,"""Synonym = Andropogon glomeratus (Walter) B.S.P. var. pumilus Vasey""",,,,"Reese, William D.",,644,10/6/55,1955,10,6,279,,,,,,,,,,,,,,,,,,,United States,Florida,Wakulla,,"On dike,",,,,30.17031212,-84.40264545,,,,,,,,,,,,,,,,en,Philip Straughn,7/1/16 13:19,,206,urn:uuid:fe3c021f-7c74-4071-b426-41dff0706917,http://sernecportal.org/portal/collections/individual/index.php?occid=7924840
7924868,NCU,,,PreservedSpecimen,3d4feb71-5b0c-46a1-868f-f8a7ca767beb,NCU00077634,286820,Plantae,Magnoliophyta,,Poales,Poaceae,Andropogon glomeratus var. pumilus ,14575,(Nash) Nash,Andropogon,glomeratus,var.,pumilus ,"Sorrie, Bruce A.",2015,,"""Synonym = Andropogon glomeratus (Walter) B.S.P. var. pumilus Vasey""",,,,"Hall, David",,219,10/17/64,1964,10,17,291,,,,sand dune,,Habit: Herb,,,,,,,,,,,,,United States,Georgia,Chatham,,Savannah Beach,,,,32.00993768,-81.14157431,,,,,,,,,,,,,,,,en,Philip Straughn,5/30/16 16:50,,206,urn:uuid:3d4feb71-5b0c-46a1-868f-f8a7ca767beb,http://sernecportal.org/portal/collections/individual/index.php?occid=7924868
7924872,NCU,,,PreservedSpecimen,e9cb9f1e-89ed-4a55-b9c6-64cefeb94568,NCU00077635,394437,Plantae,Magnoliophyta,,Poales,Poaceae,Andropogon glomeratus var. pumilus ,14575,(Nash) Nash,Andropogon,glomeratus,var.,pumilus ,"Sorrie, Bruce A.",2015,,"""Synonym = Andropogon glomeratus (Walter) B.S.P. var. pumilus Vasey""",,,,"Faircloth, Wayne R.","Cribbs, Wm. H.",5003,11/18/67,1967,11,18,322,,,,Alluvial bars,,,,,,,,,,,,,,,United States,Georgia,Clinch,,Alluvial bars along the high water level of the Suwannee River in Fargo. COASTAL PLAIN PROVINCE.,,,,30.91507339,-82.70632684,,,,,,,,,,,,,,,,en,Philip Straughn,5/30/16 17:31,,206,urn:uuid:e9cb9f1e-89ed-4a55-b9c6-64cefeb94568,http://sernecportal.org/portal/collections/individual/index.php?occid=7924872
7924874,NCU,,,PreservedSpecimen,c7601e43-976e-48c7-b06e-b21540e0c913,NCU00077636,104263,Plantae,Magnoliophyta,,Poales,Poaceae,Andropogon glomeratus var. pumilus ,14575,(Nash) Nash,Andropogon,glomeratus,var.,pumilus ,"Sorrie, Bruce A.",2015,,"""Synonym = Andropogon glomeratus (Walter) B.S.P. var. pumilus Vasey""",,,,"Duncan, Wilbur H.",,20634,10/14/56,1956,10,14,288,,,,Low area between low sandy ridges back of beach dunes.,,Plants to 1.8 meters tall; culms single or in clumps up to 8.,,,,,,,,,,,,,United States,Georgia,McIntosh,,Low area between low sandy ridges back of beach dunes on Sapelo Island.,,,,31.53298214,-81.26461212,,,,,,,,,,,,,,,,en,Philip Straughn,5/30/16 17:28,,206,urn:uuid:c7601e43-976e-48c7-b06e-b21540e0c913,http://sernecportal.org/portal/collections/individual/index.php?occid=7924874
7924882,NCU,,,PreservedSpecimen,b8932a6e-534d-488c-85af-9762815ee8b5,NCU00077643,450175,Plantae,Magnoliophyta,,Poales,Poaceae,Andropogon glomeratus var. pumilus ,14575,(Nash) Nash,Andropogon,glomeratus,var.,pumilus ,"Sorrie, Bruce A.",2015,,"""Synonym = Andropogon glomeratus (Walter) B.S.P. var. pumilus Vasey""",,,,"Thomas, R. Dale","Overby, Roselie",32838,10/7/72,1972,10,7,281,,,,,,,,,,,,,,,,,,,United States,Louisiana,Caddo,,"Drainage ditch in cotton fields west of La. 1 south of Shreveport along Millicent Way, Sec. 38, T17N, R13W.",,,,32.57969518,-93.88212497,,,,,,,,,,,,,,,,en,Philip Straughn,5/30/16 16:55,,206,urn:uuid:b8932a6e-534d-488c-85af-9762815ee8b5,http://sernecportal.org/portal/collections/individual/index.php?occid=7924882
7924884,NCU,,,PreservedSpecimen,6ee68f7c-ff90-468f-ae49-86cc371c9044,NCU00077644,300315,Plantae,Magnoliophyta,,Poales,Poaceae,Andropogon glomeratus var. pumilus ,14575,(Nash) Nash,Andropogon,glomeratus,var.,pumilus ,"Sorrie, Bruce A.",2015,,"""Synonym = Andropogon glomeratus (Walter) B.S.P. var. pumilus Vasey""",,,,"Thieret, John W.",,9656,10/14/62,1962,10,14,287,,,,,,,,,,,,,,,,,,,United States,Louisiana,Calcasieu,,Along railroad about 2.5 miles ESE of Holmwood.,,,,30.2292142,-93.35794782,,,,,,,,,,,,,,,,en,Philip Straughn,5/30/16 17:25,,206,urn:uuid:6ee68f7c-ff90-468f-ae49-86cc371c9044,http://sernecportal.org/portal/collections/individual/index.php?occid=7924884
7924886,NCU,,,PreservedSpecimen,591447e9-191e-4c30-919b-7a9c761c8a21,NCU00077645,325522,Plantae,Magnoliophyta,,Poales,Poaceae,Andropogon glomeratus var. pumilus ,14575,(Nash) Nash,Andropogon,glomeratus,var.,pumilus ,"Sorrie, Bruce A.",2015,,"""Synonym = Andropogon glomeratus (Walter) B.S.P. var. pumilus Vasey""",,,,"Rogers, Ken E.","DePoe, C. E.",510,9/25/66,1966,9,25,268,,,,,,,,,,,,,,,,,,,United States,Louisiana,Concordia,,Beside La. 15 near Black Hawk Oil Field,,,,31.44575184,-91.63974306,,,,,,,,,,,,,,,,en,Philip Straughn,5/30/16 17:21,,206,urn:uuid:591447e9-191e-4c30-919b-7a9c761c8a21,http://sernecportal.org/portal/collections/individual/index.php?occid=7924886
7924888,NCU,,,PreservedSpecimen,a5399adf-13f5-4410-8cee-329a166a1584,NCU00077642,450174,Plantae,Magnoliophyta,,Poales,Poaceae,Andropogon glomeratus var. pumilus ,14575,(Nash) Nash,Andropogon,glomeratus,var.,pumilus ,"Sorrie, Bruce A.",2015,,"""Synonym = Andropogon glomeratus (Walter) B.S.P. var. pumilus Vasey""",,,,"Thomas, R. Dale",,25553,9/16/71,1971,9,16,259,,,,Roadbank,,,,,,,,,,,,,,,United States,Louisiana,Jackson,,"Roadbank of La. 34, 2 miles south of Eros, La. Sec. 23, T16N, R1W.",,,,32.30204636,-92.55774604,,,,,,,,,,,,,,,,en,Philip Straughn,5/30/16 16:57,,206,urn:uuid:a5399adf-13f5-4410-8cee-329a166a1584,http://sernecportal.org/portal/collections/individual/index.php?occid=7924888
7924890,NCU,,,PreservedSpecimen,d29edf38-c580-4944-b52a-8c59e4f1afc9,NCU00077647,544653,Plantae,Magnoliophyta,,Poales,Poaceae,Andropogon glomeratus var. pumilus ,14575,(Nash) Nash,Andropogon,glomeratus,var.,pumilus ,"Sorrie, Bruce A.",2015,,"""Synonym = Andropogon glomeratus (Walter) B.S.P. var. pumilus Vasey""",,,,"Thomas, R. Dale",Field Botany Class,93740,9/30/85,1985,9,30,273,,,,Large clear-cut woods; sandy soil,,,,,,,,,,,,,,,United States,Louisiana,Ouachita,,"Large clear-cut woods east of La. 557 between Pine Crest School and Luna; sandy soil. Sec. 25, T16N, R2E.",,,,32.47845315,-92.15453329,,,,,,,,,,,,,,,,en,Philip Straughn,5/30/16 17:19,,206,urn:uuid:d29edf38-c580-4944-b52a-8c59e4f1afc9,http://sernecportal.org/portal/collections/individual/index.php?occid=7924890
7924892,NCU,,,PreservedSpecimen,d3d4a2cd-d040-4eff-8625-d85c1031f16a,NCU00077646,508106,Plantae,Magnoliophyta,,Poales,Poaceae,Andropogon glomeratus var. pumilus ,14575,(Nash) Nash,Andropogon,glomeratus,var.,pumilus ,"Sorrie, Bruce A.",2015,,"""Synonym = Andropogon glomeratus (Walter) B.S.P. var. pumilus Vasey""",,,,"Fleming, N. F.",,452,,,,,,,,,,,,,,,,,,,,,,,,United States,Louisiana,Plaquemines,,,,,,29.47029014,-89.65499309,,,,,,,,,,,,,,,,en,Philip Straughn,7/1/16 13:19,,206,urn:uuid:d3d4a2cd-d040-4eff-8625-d85c1031f16a,http://sernecportal.org/portal/collections/individual/index.php?occid=7924892
7924895,NCU,,,PreservedSpecimen,e04c4848-adaa-49dc-9bfd-710116639aca,NCU00077648,513769,Plantae,Magnoliophyta,,Poales,Poaceae,Andropogon glomeratus var. pumilus ,14575,(Nash) Nash,Andropogon,glomeratus,var.,pumilus ,"Sorrie, Bruce A.",2015,,"""Synonym = Andropogon glomeratus (Walter) B.S.P. var. pumilus Vasey""",,,,"Smith, Carey",,1820,9/20/74,1974,9,20,263,,,,,,,,,,,,,,,,,,,United States,Louisiana,Union,,".7 mile north northeast of Haile, La. on parish road at Haile Creek, Sec. 3, R3E, T22N.",,,,32.83189455,-92.37480788,,,,,,,,,,,,,,,,en,Philip Straughn,5/30/16 17:02,,206,urn:uuid:e04c4848-adaa-49dc-9bfd-710116639aca,http://sernecportal.org/portal/collections/individual/index.php?occid=7924895
7924896,NCU,,,PreservedSpecimen,3e559c71-7dcb-4b5c-879b-99c433c9879d,NCU00077641,420717,Plantae,Magnoliophyta,,Poales,Poaceae,Andropogon glomeratus var. pumilus ,14575,(Nash) Nash,Andropogon,glomeratus,var.,pumilus ,"Sorrie, Bruce A.",2015,,"""Synonym = Andropogon glomeratus (Walter) B.S.P. var. pumilus Vasey""",,,,"Rogers, Ken E.",,2409-B,10/18/69,1969,10,18,291,,,,,,,,,,,,,,,,,,,United States,Louisiana,Union,,Vicinity of Albany.,,,,32.83189455,-92.37480788,,,,,,,,,,,,,,,,en,Philip Straughn,5/30/16 17:00,,206,urn:uuid:3e559c71-7dcb-4b5c-879b-99c433c9879d,http://sernecportal.org/portal/collections/individual/index.php?occid=7924896
7924900,NCU,,,PreservedSpecimen,af908b2c-384c-4d12-927d-2480a4ef6d45,NCU00077649,187388,Plantae,Magnoliophyta,,Poales,Poaceae,Andropogon glomeratus var. pumilus ,14575,(Nash) Nash,Andropogon,glomeratus,var.,pumilus ,"Sorrie, Bruce A.",2015,,"""Synonym = Andropogon glomeratus (Walter) B.S.P. var. pumilus Vasey""",,,,"Reese, William D.",,3906,10/22/60,1960,10,22,296,,"22-23 Oct., 1960",,Occasional in dense clumps along low shell ridge along beach.,,,,,,,,,,,,,,,United States,Louisiana,Vermilion,,"Occasional in dense clumps along low shell ridge along beach; vic. of USL Field Station Redfish Point, west side of Vermillion Bay.",,,,29.84553715,-92.32406212,,,,,,,,,,,,,,,,en,Philip Straughn,5/30/16 17:16,,206,urn:uuid:af908b2c-384c-4d12-927d-2480a4ef6d45,http://sernecportal.org/portal/collections/individual/index.php?occid=7924900
7924903,NCU,,,PreservedSpecimen,3426af85-265e-4481-9765-4d7a6adab3f3,NCU00077651,196341,Plantae,Magnoliophyta,,Poales,Poaceae,Andropogon glomeratus var. pumilus ,14575,(Nash) Nash,Andropogon,glomeratus,var.,pumilus ,"Sorrie, Bruce A.",2015,,"""Synonym = Andropogon glomeratus (Walter) B.S.P. var. pumilus Vasey""",,,,,,,,,,,,,,,,,,,,,,,,,,,,,,United States,Mississippi,Bolivar,,,,,,33.79553662,-90.88040782,,,,,,,,,,,,,,,,en,Philip Straughn,7/1/16 12:21,,206,urn:uuid:3426af85-265e-4481-9765-4d7a6adab3f3,http://sernecportal.org/portal/collections/individual/index.php?occid=7924903
7924904,NCU,,,PreservedSpecimen,d6d2345c-e1ba-4033-a836-eedfc17acd14,NCU00077652,447486,Plantae,Magnoliophyta,,Poales,Poaceae,Andropogon glomeratus var. pumilus ,14575,(Nash) Nash,Andropogon,glomeratus,var.,pumilus ,"Sorrie, Bruce A.",2015,,"""Synonym = Andropogon glomeratus (Walter) B.S.P. var. pumilus Vasey""",,,,"Temple, Louis C.",,4669,10/22/66,1966,10,22,295,,,,In and along open edge of low deciduous woods behind levee,,,,,,,,,,,,,,,United States,Mississippi,Bolivar,,"In and along open edge of low deciduous woods behind levee, about 2.2 mi. N. of Gunnison.",,,,33.79553662,-90.88040782,,,,,,,,,,,,,,,,en,Philip Straughn,5/30/16 17:13,,206,urn:uuid:d6d2345c-e1ba-4033-a836-eedfc17acd14,http://sernecportal.org/portal/collections/individual/index.php?occid=7924904
7924905,NCU,,,PreservedSpecimen,ada70f2e-5293-410b-82bb-6a6fa752112b,NCU00077653,420652,Plantae,Magnoliophyta,,Poales,Poaceae,Andropogon glomeratus var. pumilus ,14575,(Nash) Nash,Andropogon,glomeratus,var.,pumilus ,"Sorrie, Bruce A.",2015,,"""Synonym = Andropogon glomeratus (Walter) B.S.P. var. pumilus Vasey""",,,,"Rogers, Ken E.",,7342-E,11/30/71,1971,11,30,334,,,,,,,,,,,,,,,,,,,United States,Mississippi,Forrest,,,,,,31.18885566,-89.25786254,,,,,,,,,,,,,,,,en,Philip Straughn,5/26/16 17:42,,206,urn:uuid:ada70f2e-5293-410b-82bb-6a6fa752112b,http://sernecportal.org/portal/collections/individual/index.php?occid=7924905
7924907,NCU,,,PreservedSpecimen,e7a1ff37-fe4d-4d31-93a6-32ae3931cd77,NCU00077654,142606,Plantae,Magnoliophyta,,Poales,Poaceae,Andropogon glomeratus var. pumilus ,14575,(Nash) Nash,Andropogon,glomeratus,var.,pumilus ,"Sorrie, Bruce A.",2015,,"""Synonym = Andropogon glomeratus (Walter) B.S.P. var. pumilus Vasey""",,,,"Demaree, Delzie",,36294,10/31/54,1954,10,31,304,,,,Dry pine barrens,,,,,,,,,,,,,,,United States,Mississippi,Hancock,,Dry pine barrens. Bay Saint Louis Post Office.,,,,30.41637505,-89.48872349,,,,,,,,,,,,,,,,en,Philip Straughn,5/26/16 17:39,,206,urn:uuid:e7a1ff37-fe4d-4d31-93a6-32ae3931cd77,http://sernecportal.org/portal/collections/individual/index.php?occid=7924907
7924908,NCU,,,PreservedSpecimen,7b95b9d0-e011-4483-a385-84db1ef58917,NCU00077655,142905,Plantae,Magnoliophyta,,Poales,Poaceae,Andropogon glomeratus var. pumilus ,14575,(Nash) Nash,Andropogon,glomeratus,var.,pumilus ,"Sorrie, Bruce A.",2015,,"""Synonym = Andropogon glomeratus (Walter) B.S.P. var. pumilus Vasey""",,,,"Demaree, Delzie",,36318,10/31/54,1954,10,31,304,,,,,,,,,,,,,,,,,,,United States,Mississippi,Hancock,,Dry pine barrens. P. O. Kiln.,,,,30.41637505,-89.48872349,,,,,,,,,,,,,,,,en,Philip Straughn,5/30/16 17:04,,206,urn:uuid:7b95b9d0-e011-4483-a385-84db1ef58917,http://sernecportal.org/portal/collections/individual/index.php?occid=7924908
7924910,NCU,,,PreservedSpecimen,52fe1e84-9734-43b2-8970-b82400bc8521,NCU00077656,142670,Plantae,Magnoliophyta,,Poales,Poaceae,Andropogon glomeratus var. pumilus ,14575,(Nash) Nash,Andropogon,glomeratus,var.,pumilus ,"Sorrie, Bruce A.",2015,,"""Synonym = Andropogon glomeratus (Walter) B.S.P. var. pumilus Vasey""",,,,"Demaree, Delzie",,34404,9/27/53,1953,9,27,270,,,,,,,,,,,,,,,,,,,United States,Mississippi,Jackson,,Valley land. P. O. Hurley.,,,,30.54591851,-88.63622701,,,,,,,,,,,,,,,,en,Philip Straughn,5/30/16 17:08,,206,urn:uuid:52fe1e84-9734-43b2-8970-b82400bc8521,http://sernecportal.org/portal/collections/individual/index.php?occid=7924910
7924911,NCU,,,PreservedSpecimen,ec9a9041-1b8b-4c2c-865b-944800b373da,NCU00077657,142665,Plantae,Magnoliophyta,,Poales,Poaceae,Andropogon glomeratus var. pumilus ,14575,(Nash) Nash,Andropogon,glomeratus,var.,pumilus ,"Sorrie, Bruce A.",2015,,"""Synonym = Andropogon glomeratus (Walter) B.S.P. var. pumilus Vasey""",,,,"Demaree, Delzie",,34429,10/1/53,1953,10,1,274,,,,,,,,,,,,,,,,,,,United States,Mississippi,Jackson,,Dry pine barrens. P. O. Ocean Springs.,,,,30.54591851,-88.63622701,,,,,,,,,,,,,,,,en,Philip Straughn,5/30/16 17:06,,206,urn:uuid:ec9a9041-1b8b-4c2c-865b-944800b373da,http://sernecportal.org/portal/collections/individual/index.php?occid=7924911
7924913,NCU,,,PreservedSpecimen,cf4290f2-37c9-4efe-a11f-9badbba9fe72,NCU00077658,523403,Plantae,Magnoliophyta,,Poales,Poaceae,Andropogon glomeratus var. pumilus ,14575,(Nash) Nash,Andropogon,glomeratus,var.,pumilus ,"Sorrie, Bruce A.",2015,,"""Synonym = Andropogon glomeratus (Walter) B.S.P. var. pumilus Vasey""",,,,"Campbell, C. S.",,3954,11/6/77,1977,11,6,310,,,,field,,,,,,,,,,,,,,,United States,Mississippi,Lauderdale,,"Flora of Lauderdale Co., Mississippi field near rts. 11 and 80, 8 E. of overpass of rts. 20 and 59, by Stuckey's",,,,32.40425932,-88.66256213,,,,,,,,,,,,,,,,en,Philip Straughn,5/26/16 17:38,,206,urn:uuid:cf4290f2-37c9-4efe-a11f-9badbba9fe72,http://sernecportal.org/portal/collections/individual/index.php?occid=7924913
7924915,NCU,,,PreservedSpecimen,72664013-1009-4a71-bb7e-322c21e9f479,NCU00077650,16563,Plantae,Magnoliophyta,,Poales,Poaceae,Andropogon glomeratus var. pumilus ,14575,(Nash) Nash,Andropogon,glomeratus,var.,pumilus ,,,,,,,,,,,,,,,,,,,,,,,,,,,,,,,,,,United States,Mississippi,Harrison,,,,,,30.51500982,-89.11854318,,,,,,,,,,,,,,,,en,Philip Straughn,7/1/16 12:20,,206,urn:uuid:72664013-1009-4a71-bb7e-322c21e9f479,http://sernecportal.org/portal/collections/individual/index.php?occid=7924915
7924917,NCU,,,PreservedSpecimen,3ade6de7-5043-4e65-8dbf-abddaba32d14,NCU00044223,423194,Plantae,Magnoliophyta,,Poales,Poaceae,Andropogon glomeratus var. pumilus ,14575,(Nash) Nash,Andropogon,glomeratus,var.,pumilus ,"Sorrie, Bruce A.",2015,,"""Synonym = Andropogon glomeratus (Walter) B.S.P. var. pumilus Vasey""",,,,"Depp Salle, Emily",,736,9/23/71,1971,9,23,266,,,,In grassy roadside,,,,,,,,,,,,,,,United States,Virginia,York,,"In grassy roadside between Sandy Point and road, ca. 1/10 mi. east of Indian Field Creek, on northern side of Yorktown Colonial Parkway.",,,,37.2046153,-76.4685953,,,,,,,,,,,,,,,,en,Philip Straughn,5/26/16 17:33,,206,urn:uuid:3ade6de7-5043-4e65-8dbf-abddaba32d14,http://sernecportal.org/portal/collections/individual/index.php?occid=7924917
7968728,NCU,,,PreservedSpecimen,b5cc258e-0e44-4ef3-aec8-0347246373ca,NCU00074613,179517,Plantae,Magnoliophyta,,Poales,Poaceae,Andropogon glomeratus var. pumilus ,14575,(Nash) Nash,Andropogon,glomeratus,var.,pumilus ,,,,,,,,,,,,,,,,,,,,,,,,,,,,,,,,,,United States,North Carolina,Beaufort,,,,0,,35.49474455,-76.86307654,,,,,,,,,,,,,,,,en,dylandy,11/23/15 16:43,,206,urn:uuid:b5cc258e-0e44-4ef3-aec8-0347246373ca,http://sernecportal.org/portal/collections/individual/index.php?occid=7968728
7968732,NCU,,,PreservedSpecimen,170f1315-27b3-48fa-a3c7-6e3bb47fee11,NCU00074614,183242,Plantae,Magnoliophyta,,Poales,Poaceae,Andropogon glomeratus var. pumilus ,14575,(Nash) Nash,Andropogon,glomeratus,var.,pumilus ,,,,,,,,,,,,,,,,,,,,,,,,,,,,,,,,,,United States,North Carolina,Beaufort,,,,,,35.49474455,-76.86307654,,,,,,,,,,,,,,,,en,dylandy,11/25/15 9:57,,206,urn:uuid:170f1315-27b3-48fa-a3c7-6e3bb47fee11,http://sernecportal.org/portal/collections/individual/index.php?occid=7968732
7968737,NCU,,,PreservedSpecimen,500bab16-4ecc-4b0e-98cf-f9a7b0cdae1f,NCU00074620,570373,Plantae,Magnoliophyta,,Poales,Poaceae,Andropogon glomeratus var. pumilus ,14575,(Nash) Nash,Andropogon,glomeratus,var.,pumilus ,,,,,,,,,,,,,,,,,,,,,,,,,,,,,,,,,,United States,North Carolina,Brunswick,,,,,,33.96338911,-78.05986393,,,,,,,,,,,,,,,,en,dylandy,11/25/15 9:57,,206,urn:uuid:500bab16-4ecc-4b0e-98cf-f9a7b0cdae1f,http://sernecportal.org/portal/collections/individual/index.php?occid=7968737
7968739,NCU,,,PreservedSpecimen,0a59665c-db6d-45a1-b3c7-94e251731476,NCU00074621,186145,Plantae,Magnoliophyta,,Poales,Poaceae,Andropogon glomeratus var. pumilus ,14575,(Nash) Nash,Andropogon,glomeratus,var.,pumilus ,,,,,,,,,,,,,,,,,,,,,,,,,,,,,,,,,,United States,North Carolina,Brunswick,,,,,,33.96338911,-78.05986393,,,,,,,,,,,,,,,,en,dylandy,11/25/15 9:57,,206,urn:uuid:0a59665c-db6d-45a1-b3c7-94e251731476,http://sernecportal.org/portal/collections/individual/index.php?occid=7968739
7968741,NCU,,,PreservedSpecimen,ae9e48ea-a106-4af7-b8a7-21f5ea604249,NCU00074622,24418,Plantae,Magnoliophyta,,Poales,Poaceae,Andropogon glomeratus var. pumilus ,14575,(Nash) Nash,Andropogon,glomeratus,var.,pumilus ,,,,,,,,,,,,,,,,,,,,,,,,,,,,,,,,,,United States,North Carolina,Brunswick,,,,,,33.96338911,-78.05986393,,,,,,,,,,,,,,,,en,dylandy,11/25/15 9:57,,206,urn:uuid:ae9e48ea-a106-4af7-b8a7-21f5ea604249,http://sernecportal.org/portal/collections/individual/index.php?occid=7968741
7968744,NCU,,,PreservedSpecimen,db83737b-f96d-41d0-990e-e36c410e510a,NCU00075782,494814,Plantae,Magnoliophyta,,Poales,Poaceae,Andropogon glomeratus var. pumilus ,14575,(Nash) Nash,Andropogon,glomeratus,var.,pumilus ,,,,,,,,,,,,,,,,,,,,,,,,,,,,,,,,,,United States,North Carolina,Carteret,,,,,,34.8327128,-76.67067659,,,,,,,,,,,,,,,,en,dylandy,11/25/15 9:57,,206,urn:uuid:db83737b-f96d-41d0-990e-e36c410e510a,http://sernecportal.org/portal/collections/individual/index.php?occid=7968744
7968746,NCU,,,PreservedSpecimen,39268b31-daaf-4b1f-b4fa-c1dbaf0de3c0,NCU00075783,494813,Plantae,Magnoliophyta,,Poales,Poaceae,Andropogon glomeratus var. pumilus ,14575,(Nash) Nash,Andropogon,glomeratus,var.,pumilus ,,,,,,,,,,,,,,,,,,,,,,,,,,,,,,,,,,United States,North Carolina,Carteret,,,,,,34.8327128,-76.67067659,,,,,,,,,,,,,,,,en,dylandy,11/25/15 9:57,,206,urn:uuid:39268b31-daaf-4b1f-b4fa-c1dbaf0de3c0,http://sernecportal.org/portal/collections/individual/index.php?occid=7968746
7968748,NCU,,,PreservedSpecimen,33f4acbf-e352-4827-9471-39b569cb6520,NCU00075781,494812,Plantae,Magnoliophyta,,Poales,Poaceae,Andropogon glomeratus var. pumilus ,14575,(Nash) Nash,Andropogon,glomeratus,var.,pumilus ,,,,,,,,,,,,,,,,,,,,,,,,,,,,,,,,,,United States,North Carolina,Carteret,,,,,,34.8327128,-76.67067659,,,,,,,,,,,,,,,,en,dylandy,11/25/15 9:57,,206,urn:uuid:33f4acbf-e352-4827-9471-39b569cb6520,http://sernecportal.org/portal/collections/individual/index.php?occid=7968748
7968751,NCU,,,PreservedSpecimen,88b968d9-f20a-4f76-85a0-95f8912a8b4c,NCU00074801,2789,Plantae,Magnoliophyta,,Poales,Poaceae,Andropogon glomeratus var. pumilus ,14575,(Nash) Nash,Andropogon,glomeratus,var.,pumilus ,,,,,,,,,,,,,,,,,,,,,,,,,,,,,,,,,,United States,North Carolina,Carteret,,,,,,34.8327128,-76.67067659,,,,,,,,,,,,,,,,en,dylandy,11/25/15 9:57,,206,urn:uuid:88b968d9-f20a-4f76-85a0-95f8912a8b4c,http://sernecportal.org/portal/collections/individual/index.php?occid=7968751
7968754,NCU,,,PreservedSpecimen,167c46ae-7bcc-4826-87da-dde598b82f50,NCU00074804,398123,Plantae,Magnoliophyta,,Poales,Poaceae,Andropogon glomeratus var. pumilus ,14575,(Nash) Nash,Andropogon,glomeratus,var.,pumilus ,,,,,,,,,,,,,,,,,,,,,,,,,,,,,,,,,,United States,North Carolina,Carteret,,,,,,34.8327128,-76.67067659,,,,,,,,,,,,,,,,en,dylandy,11/25/15 9:57,,206,urn:uuid:167c46ae-7bcc-4826-87da-dde598b82f50,http://sernecportal.org/portal/collections/individual/index.php?occid=7968754
7968759,NCU,,,PreservedSpecimen,9b2fe423-bc5a-4915-a387-57cfc8587e1b,NCU00074805,5868,Plantae,Magnoliophyta,,Poales,Poaceae,Andropogon glomeratus var. pumilus ,14575,(Nash) Nash,Andropogon,glomeratus,var.,pumilus ,,,,,,,,,,,,,,,,,,,,,,,,,,,,,,,,,,United States,North Carolina,Carteret,,,,,,34.8327128,-76.67067659,,,,,,,,,,,,,,,,en,dylandy,11/25/15 9:57,,206,urn:uuid:9b2fe423-bc5a-4915-a387-57cfc8587e1b,http://sernecportal.org/portal/collections/individual/index.php?occid=7968759
7968763,NCU,,,PreservedSpecimen,10057fa7-e210-442b-8d8e-9f97429111ad,NCU00128167,596817,Plantae,Magnoliophyta,,Poales,Poaceae,Andropogon glomeratus var. pumilus ,14575,(Nash) Nash,Andropogon,glomeratus,var.,pumilus ,,,,,,,,,,,,,,,,,,,,,,,,,,,,,,,,,,United States,North Carolina,Catawba,,,,,,35.66263814,-81.21443507,,,,,,,,,,,,,,,,en,dylandy,11/25/15 9:57,,206,urn:uuid:10057fa7-e210-442b-8d8e-9f97429111ad,http://sernecportal.org/portal/collections/individual/index.php?occid=7968763
7968767,NCU,,,PreservedSpecimen,5bc28acf-7234-4829-98d7-2b97ea1a7a99,NCU00074816,405087,Plantae,Magnoliophyta,,Poales,Poaceae,Andropogon glomeratus var. pumilus ,14575,(Nash) Nash,Andropogon,glomeratus,var.,pumilus ,,,,,,,,,,,,,,,,,,,,,,,,,,,,,,,,,,United States,North Carolina,Dare,,,,,,35.77146061,-75.80088874,,,,,,,,,,,,,,,,en,dylandy,11/25/15 9:57,,206,urn:uuid:5bc28acf-7234-4829-98d7-2b97ea1a7a99,http://sernecportal.org/portal/collections/individual/index.php?occid=7968767
7968770,NCU,,,PreservedSpecimen,df7da9c8-8467-4a96-8a45-bd18d39ba1fb,NCU00074817,56356,Plantae,Magnoliophyta,,Poales,Poaceae,Andropogon glomeratus var. pumilus ,14575,(Nash) Nash,Andropogon,glomeratus,var.,pumilus ,,,,,,,,,,,,,,,,,,,,,,,,,,,,,,,,,,United States,North Carolina,Dare,,,,,,35.77146061,-75.80088874,,,,,,,,,,,,,,,,en,dylandy,11/25/15 9:57,,206,urn:uuid:df7da9c8-8467-4a96-8a45-bd18d39ba1fb,http://sernecportal.org/portal/collections/individual/index.php?occid=7968770
7968777,NCU,,,PreservedSpecimen,e7a406a8-d934-4617-823e-9ff7cc063b7f,NCU00074818,405088,Plantae,Magnoliophyta,,Poales,Poaceae,Andropogon glomeratus var. pumilus ,14575,(Nash) Nash,Andropogon,glomeratus,var.,pumilus ,,,,,,,,,,,,,,,,,,,,,,,,,,,,,,,,,,United States,North Carolina,Hyde,,,,,,35.53180783,-76.24849083,,,,,,,,,,,,,,,,en,dylandy,11/25/15 9:57,,206,urn:uuid:e7a406a8-d934-4617-823e-9ff7cc063b7f,http://sernecportal.org/portal/collections/individual/index.php?occid=7968777
7968778,NCU,,,PreservedSpecimen,9df5e0f2-46f5-4f48-bac6-457037119403,NCU00074819,270255,Plantae,Magnoliophyta,,Poales,Poaceae,Andropogon glomeratus var. pumilus ,14575,(Nash) Nash,Andropogon,glomeratus,var.,pumilus ,,,,,,,,,,,,,,,,,,,,,,,,,,,,,,,,,,United States,North Carolina,Dare,,,,,,35.77146061,-75.80088874,,,,,,,,,,,,,,,,en,dylandy,11/25/15 9:57,,206,urn:uuid:9df5e0f2-46f5-4f48-bac6-457037119403,http://sernecportal.org/portal/collections/individual/index.php?occid=7968778
7968780,NCU,,,PreservedSpecimen,5736e75d-be1e-4b6b-9add-144b55ec21ea,NCU00074832,179520,Plantae,Magnoliophyta,,Poales,Poaceae,Andropogon glomeratus var. pumilus ,14575,(Nash) Nash,Andropogon,glomeratus,var.,pumilus ,,,,,,,,,,,,,,,,,,,,,,,,,,,,,,,,,,United States,North Carolina,Hyde,,,,,,35.53180783,-76.24849083,,,,,,,,,,,,,,,,en,dylandy,11/25/15 9:57,,206,urn:uuid:5736e75d-be1e-4b6b-9add-144b55ec21ea,http://sernecportal.org/portal/collections/individual/index.php?occid=7968780
7968782,NCU,,,PreservedSpecimen,36ba6636-ebb3-44da-94f6-669793216e1e,NCU00128919,597016,Plantae,Magnoliophyta,,Poales,Poaceae,Andropogon glomeratus var. pumilus ,14575,(Nash) Nash,Andropogon,glomeratus,var.,pumilus ,,,,,,,,,,,,,,,,,,,,,,,,,,,,,,,,,,United States,North Carolina,Iredell,,,,,,35.80721882,-80.87364479,,,,,,,,,,,,,,,,en,dylandy,11/25/15 9:57,,206,urn:uuid:36ba6636-ebb3-44da-94f6-669793216e1e,http://sernecportal.org/portal/collections/individual/index.php?occid=7968782
7968785,NCU,,,PreservedSpecimen,f1d27f0c-afa2-43c3-bb0c-0da3be855feb,NCU00074841,274892,Plantae,Magnoliophyta,,Poales,Poaceae,Andropogon glomeratus var. pumilus ,14575,(Nash) Nash,Andropogon,glomeratus,var.,pumilus ,,,,,,,,,,,,,,,,,,,,,,,,,,,,,,,,,,United States,North Carolina,New Hanover,,,,,,34.10463251,-77.89212633,,,,,,,,,,,,,,,,en,dylandy,11/25/15 9:57,,206,urn:uuid:f1d27f0c-afa2-43c3-bb0c-0da3be855feb,http://sernecportal.org/portal/collections/individual/index.php?occid=7968785
7968792,NCU,,,PreservedSpecimen,5e8bf131-8647-4a0b-aaa7-eb323be4922f,NCU00074845,149487,Plantae,Magnoliophyta,,Poales,Poaceae,Andropogon glomeratus var. pumilus ,14575,(Nash) Nash,Andropogon,glomeratus,var.,pumilus ,,,,,,,,,,,,,,,,,,,,,,,,,,,,,,,,,,United States,North Carolina,Pasquotank,,,,,,36.29741988,-76.28674077,,,,,,,,,,,,,,,,en,dylandy,11/25/15 9:57,,206,urn:uuid:5e8bf131-8647-4a0b-aaa7-eb323be4922f,http://sernecportal.org/portal/collections/individual/index.php?occid=7968792
7968795,NCU,,,PreservedSpecimen,375db94c-cf6c-4acd-a6e3-ff0436094e1b,NCU00074849,479045,Plantae,Magnoliophyta,,Poales,Poaceae,Andropogon glomeratus var. pumilus ,14575,(Nash) Nash,Andropogon,glomeratus,var.,pumilus ,,,,,,,,,,,,,,,,,,,,,,,,,,,,,,,,,,United States,North Carolina,Randolph,,,,,,35.7102791,-79.80603396,,,,,,,,,,,,,,,,en,dylandy,11/25/15 9:57,,206,urn:uuid:375db94c-cf6c-4acd-a6e3-ff0436094e1b,http://sernecportal.org/portal/collections/individual/index.php?occid=7968795
7968796,NCU,,,PreservedSpecimen,19eacd3b-8272-4b29-b880-742f6886a893,NCU00027609,568718,Plantae,Magnoliophyta,,Poales,Poaceae,Andropogon glomeratus var. pumilus ,14575,(Nash) Nash,Andropogon,glomeratus,var.,pumilus ,,,,,,,,,,,,,,,,,,,,,,,,,,,,,,,,,,United States,North Carolina,Richmond,,,,,,35.00593583,-79.7479669,,,,,,,,,,,,,,,,en,dylandy,11/25/15 9:57,,206,urn:uuid:19eacd3b-8272-4b29-b880-742f6886a893,http://sernecportal.org/portal/collections/individual/index.php?occid=7968796
7968798,NCU,,,PreservedSpecimen,71488f3d-d110-40b0-a9a0-efea11cb6049,NCU00027610,568719,Plantae,Magnoliophyta,,Poales,Poaceae,Andropogon glomeratus var. pumilus ,14575,(Nash) Nash,Andropogon,glomeratus,var.,pumilus ,,,,,,,,,,,,,,,,,,,,,,,,,,,,,,,,,,United States,North Carolina,Richmond,,,,,,35.00593583,-79.7479669,,,,,,,,,,,,,,,,en,dylandy,11/25/15 9:57,,206,urn:uuid:71488f3d-d110-40b0-a9a0-efea11cb6049,http://sernecportal.org/portal/collections/individual/index.php?occid=7968798
7968800,NCU,,,PreservedSpecimen,e0b3d235-8aed-4e80-9187-7723182fa949,NCU00074852,150172,Plantae,Magnoliophyta,,Poales,Poaceae,Andropogon glomeratus var. pumilus ,14575,(Nash) Nash,Andropogon,glomeratus,var.,pumilus ,,,,,,,,,,,,,,,,,,,,,,,,,,,,,,,,,,United States,North Carolina,Robeson,,,,,,34.64013769,-79.10350863,,,,,,,,,,,,,,,,en,dylandy,11/25/15 9:57,,206,urn:uuid:e0b3d235-8aed-4e80-9187-7723182fa949,http://sernecportal.org/portal/collections/individual/index.php?occid=7968800
7968804,NCU,,,PreservedSpecimen,906610f7-86d8-4d9c-95d3-ff6190642840,NCU00074854,117706,Plantae,Magnoliophyta,,Poales,Poaceae,Andropogon glomeratus var. pumilus ,14575,(Nash) Nash,Andropogon,glomeratus,var.,pumilus ,,,,,,,,,,,,,,,,,,,,,,,,,,,,,,,,,,United States,North Carolina,Rowan,,,,,,35.63964401,-80.52470077,,,,,,,,,,,,,,,,en,dylandy,11/25/15 9:57,,206,urn:uuid:906610f7-86d8-4d9c-95d3-ff6190642840,http://sernecportal.org/portal/collections/individual/index.php?occid=7968804
7968816,NCU,,,PreservedSpecimen,6e15c6ae-9f95-4275-ae5a-127e97a11c18,NCU00074856,458642,Plantae,Magnoliophyta,,Poales,Poaceae,Andropogon glomeratus var. pumilus ,14575,(Nash) Nash,Andropogon,glomeratus,var.,pumilus ,,,,,,,,,,,,,,,,,,,,,,,,,,,,,,,,,,United States,North Carolina,Scotland,,,,,,34.84108765,-79.48049178,,,,,,,,,,,,,,,,en,dylandy,11/25/15 9:57,,206,urn:uuid:6e15c6ae-9f95-4275-ae5a-127e97a11c18,http://sernecportal.org/portal/collections/individual/index.php?occid=7968816
7968817,NCU,,,PreservedSpecimen,d96c0388-30c3-4d1f-925e-a2fec784e830,NCU00098724,588238,Plantae,Magnoliophyta,,Poales,Poaceae,Andropogon glomeratus var. pumilus ,14575,(Nash) Nash,Andropogon,glomeratus,var.,pumilus ,,,,,,,,,,,,,,,,,,,,,,,,,,,,,,,,,,United States,North Carolina,Stanly,,,,,,35.31201475,-80.25067487,,,,,,,,,,,,,,,,en,dylandy,11/25/15 9:57,,206,urn:uuid:d96c0388-30c3-4d1f-925e-a2fec784e830,http://sernecportal.org/portal/collections/individual/index.php?occid=7968817
7968818,NCU,,,PreservedSpecimen,391a8378-c867-4dc3-aab2-9fda8d1dee70,NCU00074860,179179,Plantae,Magnoliophyta,,Poales,Poaceae,Andropogon glomeratus var. pumilus ,14575,(Nash) Nash,Andropogon,glomeratus,var.,pumilus ,,,,,,,,,,,,,,,,,,,,,,,,,,,,,,,,,,United States,North Carolina,Tyrrell,,,,,,35.81613942,-76.21181713,,,,,,,,,,,,,,,,en,dylandy,11/25/15 9:57,,206,urn:uuid:391a8378-c867-4dc3-aab2-9fda8d1dee70,http://sernecportal.org/portal/collections/individual/index.php?occid=7968818
7968819,NCU,,,PreservedSpecimen,8df9d74a-4e40-4a7b-a5a7-6ceb7bd255f8,NCU00135557,602062,Plantae,Magnoliophyta,,Poales,Poaceae,Andropogon glomeratus var. pumilus ,14575,(Nash) Nash,Andropogon,glomeratus,var.,pumilus ,,,,,,,,,,,,,,,,,,,,,,,,,,,,,,,,,,United States,North Carolina,Union,,,,,,34.98838926,-80.53073141,,,,,,,,,,,,,,,,en,dylandy,11/25/15 9:57,,206,urn:uuid:8df9d74a-4e40-4a7b-a5a7-6ceb7bd255f8,http://sernecportal.org/portal/collections/individual/index.php?occid=7968819
7968820,NCU,,,PreservedSpecimen,e9158272-ee0f-45b2-a983-3ea9d23d2f5c,NCU00135556,602063,Plantae,Magnoliophyta,,Poales,Poaceae,Andropogon glomeratus var. pumilus ,14575,(Nash) Nash,Andropogon,glomeratus,var.,pumilus ,,,,,,,,,,,,,,,,,,,,,,,,,,,,,,,,,,United States,North Carolina,Union,,,,,,34.98838926,-80.53073141,,,,,,,,,,,,,,,,en,dylandy,11/25/15 9:57,,206,urn:uuid:e9158272-ee0f-45b2-a983-3ea9d23d2f5c,http://sernecportal.org/portal/collections/individual/index.php?occid=7968820
8531262,NCU,,,PreservedSpecimen,3bcc499b-769c-497a-ada2-87d778dd283b,NCU00075969,162812,Plantae,Magnoliophyta,,Poales,Poaceae,Andropogon glomeratus var. pumilus ,14575,(Nash) Nash,Andropogon,glomeratus,var.,pumilus ,,,,,,,,,,,,,,,,,,,,,,,,,,,,,,,,,,United States,South Carolina,Abbeville,,,,,,34.22255627,-82.45872916,,,,,,,,,,,,,,,,en,wpmarinello,2/11/16 17:35,,206,urn:uuid:3bcc499b-769c-497a-ada2-87d778dd283b,http://sernecportal.org/portal/collections/individual/index.php?occid=8531262
8531264,NCU,,,PreservedSpecimen,1b28814b-82ed-4734-80c6-dee0bfbe35c1,NCU00075970,236367,Plantae,Magnoliophyta,,Poales,Poaceae,Andropogon glomeratus var. pumilus ,14575,(Nash) Nash,Andropogon,glomeratus,var.,pumilus ,,,,,,,,,,,,,,,,,,,,,,,,,,,,,,,,,,United States,South Carolina,Aiken,,,,,,33.54435453,-81.63482675,,,,,,,,,,,,,,,,en,wpmarinello,2/11/16 17:35,,206,urn:uuid:1b28814b-82ed-4734-80c6-dee0bfbe35c1,http://sernecportal.org/portal/collections/individual/index.php?occid=8531264
8531266,NCU,,,PreservedSpecimen,45b1b8c7-65cc-4284-a3c3-a49982e165b5,NCU00075971,150666,Plantae,Magnoliophyta,,Poales,Poaceae,Andropogon glomeratus var. pumilus ,14575,(Nash) Nash,Andropogon,glomeratus,var.,pumilus ,,,,,,,,,,,,,,,,,,,,,,,,,,,,,,,,,,United States,South Carolina,Allendale,,,,,,32.98810589,-81.35813166,,,,,,,,,,,,,,,,en,wpmarinello,2/11/16 17:35,,206,urn:uuid:45b1b8c7-65cc-4284-a3c3-a49982e165b5,http://sernecportal.org/portal/collections/individual/index.php?occid=8531266
8531268,NCU,,,PreservedSpecimen,b1249c59-c731-4751-813a-b291e791ca47,NCU00075973,231304,Plantae,Magnoliophyta,,Poales,Poaceae,Andropogon glomeratus var. pumilus ,14575,(Nash) Nash,Andropogon,glomeratus,var.,pumilus ,,,,,,,,,,,,,,,,,,,,,,,,,,,,,,,,,,United States,South Carolina,Barnwell,,,,,,33.26608798,-81.43499588,,,,,,,,,,,,,,,,en,wpmarinello,2/11/16 17:35,,206,urn:uuid:b1249c59-c731-4751-813a-b291e791ca47,http://sernecportal.org/portal/collections/individual/index.php?occid=8531268
8531269,NCU,,,PreservedSpecimen,3e600c65-cdcc-440d-8b9c-4b10ad2f4410,NCU00075976,85348,Plantae,Magnoliophyta,,Poales,Poaceae,Andropogon glomeratus var. pumilus ,14575,(Nash) Nash,Andropogon,glomeratus,var.,pumilus ,,,,,,,,,,,,,,,,,,,,,,,,,,,,,,,,,,United States,South Carolina,Beaufort,,,,,,32.35682591,-80.69340808,,,,,,,,,,,,,,,,en,wpmarinello,2/11/16 17:35,,206,urn:uuid:3e600c65-cdcc-440d-8b9c-4b10ad2f4410,http://sernecportal.org/portal/collections/individual/index.php?occid=8531269
8531271,NCU,,,PreservedSpecimen,e81ee451-d543-4af3-b6fc-b262565b0e6b,NCU00075978,580249,Plantae,Magnoliophyta,,Poales,Poaceae,Andropogon glomeratus var. pumilus ,14575,(Nash) Nash,Andropogon,glomeratus,var.,pumilus ,,,,,,,,,,,,,,,,,,,,,,,,,,,,,,,,,,United States,South Carolina,Berkeley,,,,,,33.19784471,-79.95075816,,,,,,,,,,,,,,,,en,wpmarinello,2/11/16 17:35,,206,urn:uuid:e81ee451-d543-4af3-b6fc-b262565b0e6b,http://sernecportal.org/portal/collections/individual/index.php?occid=8531271
8531273,NCU,,,PreservedSpecimen,6deaa1c6-7364-468b-9fb6-e6730e29f77f,NCU00075979,150677,Plantae,Magnoliophyta,,Poales,Poaceae,Andropogon glomeratus var. pumilus ,14575,(Nash) Nash,Andropogon,glomeratus,var.,pumilus ,,,,,,,,,,,,,,,,,,,,,,,,,,,,,,,,,,United States,South Carolina,Calhoun,,,,,,33.67485845,-80.78021644,,,,,,,,,,,,,,,,en,wpmarinello,2/11/16 17:35,,206,urn:uuid:6deaa1c6-7364-468b-9fb6-e6730e29f77f,http://sernecportal.org/portal/collections/individual/index.php?occid=8531273
8531275,NCU,,,PreservedSpecimen,b744e68b-1226-4a0f-b980-7d5f1efeb0e2,NCU00075980,184063,Plantae,Magnoliophyta,,Poales,Poaceae,Andropogon glomeratus var. pumilus ,14575,(Nash) Nash,Andropogon,glomeratus,var.,pumilus ,,,,,,,,,,,,,,,,,,,,,,,,,,,,,,,,,,United States,South Carolina,Charleston,,,,,,32.67137586,-80.18308296,,,,,,,,,,,,,,,,en,wpmarinello,2/11/16 17:35,,206,urn:uuid:b744e68b-1226-4a0f-b980-7d5f1efeb0e2,http://sernecportal.org/portal/collections/individual/index.php?occid=8531275
8531278,NCU,,,PreservedSpecimen,f348b448-8101-4501-a746-d40941b7b703,NCU00075981,150669,Plantae,Magnoliophyta,,Poales,Poaceae,Andropogon glomeratus var. pumilus ,14575,(Nash) Nash,Andropogon,glomeratus,var.,pumilus ,,,,,,,,,,,,,,,,,,,,,,,,,,,,,,,,,,United States,South Carolina,Chester,,,,,,34.6920596,-81.15952413,,,,,,,,,,,,,,,,en,wpmarinello,2/11/16 17:35,,206,urn:uuid:f348b448-8101-4501-a746-d40941b7b703,http://sernecportal.org/portal/collections/individual/index.php?occid=8531278
8531279,NCU,,,PreservedSpecimen,fd3003e6-7721-453c-9b04-8212eb73fac3,NCU00075988,184058,Plantae,Magnoliophyta,,Poales,Poaceae,Andropogon glomeratus var. pumilus ,14575,(Nash) Nash,Andropogon,glomeratus,var.,pumilus ,,,,,,,,,,,,,,,,,,,,,,,,,,,,,,,,,,United States,South Carolina,Dorchester,,,,,,33.07947344,-80.40524064,,,,,,,,,,,,,,,,en,wpmarinello,2/11/16 17:35,,206,urn:uuid:fd3003e6-7721-453c-9b04-8212eb73fac3,http://sernecportal.org/portal/collections/individual/index.php?occid=8531279
8531280,NCU,,,PreservedSpecimen,3afed313-dc59-469b-88b4-0e0cd0f85efc,NCU00075992,150594,Plantae,Magnoliophyta,,Poales,Poaceae,Andropogon glomeratus var. pumilus ,14575,(Nash) Nash,Andropogon,glomeratus,var.,pumilus ,,,,,,,,,,,,,,,,,,,,,,,,,,,,,,,,,,United States,South Carolina,Edgefield,,,,,,33.77230036,-81.96655821,,,,,,,,,,,,,,,,en,wpmarinello,2/11/16 17:35,,206,urn:uuid:3afed313-dc59-469b-88b4-0e0cd0f85efc,http://sernecportal.org/portal/collections/individual/index.php?occid=8531280
8531282,NCU,,,PreservedSpecimen,0b36832e-7ad2-40cc-8d44-8d963b371049,NCU00075993,150595,Plantae,Magnoliophyta,,Poales,Poaceae,Andropogon glomeratus var. pumilus ,14575,(Nash) Nash,Andropogon,glomeratus,var.,pumilus ,,,,,,,,,,,,,,,,,,,,,,,,,,,,,,,,,,United States,South Carolina,Fairfield,,,,,,34.39511066,-81.12123506,,,,,,,,,,,,,,,,en,wpmarinello,2/11/16 17:35,,206,urn:uuid:0b36832e-7ad2-40cc-8d44-8d963b371049,http://sernecportal.org/portal/collections/individual/index.php?occid=8531282
8531284,NCU,,,PreservedSpecimen,5ef48310-7402-4963-8895-b4641e20a7e1,NCU00075994,150596,Plantae,Magnoliophyta,,Poales,Poaceae,Andropogon glomeratus var. pumilus ,14575,(Nash) Nash,Andropogon,glomeratus,var.,pumilus ,,,,,,,,,,,,,,,,,,,,,,,,,,,,,,,,,,United States,South Carolina,Florence,,,,,,34.02445475,-79.70282897,,,,,,,,,,,,,,,,en,wpmarinello,2/11/16 17:35,,206,urn:uuid:5ef48310-7402-4963-8895-b4641e20a7e1,http://sernecportal.org/portal/collections/individual/index.php?occid=8531284
8531286,NCU,,,PreservedSpecimen,2dbac0f7-0ba3-4fb6-a669-b4c5a4965e99,NCU00075995,150597,Plantae,Magnoliophyta,,Poales,Poaceae,Andropogon glomeratus var. pumilus ,14575,(Nash) Nash,Andropogon,glomeratus,var.,pumilus ,,,,,,,,,,,,,,,,,,,,,,,,,,,,,,,,,,United States,South Carolina,Georgetown,,,,,,33.2833551,-79.23533775,,,,,,,,,,,,,,,,en,wpmarinello,2/11/16 17:35,,206,urn:uuid:2dbac0f7-0ba3-4fb6-a669-b4c5a4965e99,http://sernecportal.org/portal/collections/individual/index.php?occid=8531286
8531290,NCU,,,PreservedSpecimen,6aabbce3-ade2-4a10-97ec-aad9860e6243,NCU00075998,150601,Plantae,Magnoliophyta,,Poales,Poaceae,Andropogon glomeratus var. pumilus ,14575,(Nash) Nash,Andropogon,glomeratus,var.,pumilus ,,,,,,,,,,,,,,,,,,,,,,,,,,,,,,,,,,United States,South Carolina,Horry,,,,,,33.9215361,-78.99662622,,,,,,,,,,,,,,,,en,wpmarinello,2/11/16 17:35,,206,urn:uuid:6aabbce3-ade2-4a10-97ec-aad9860e6243,http://sernecportal.org/portal/collections/individual/index.php?occid=8531290
8531293,NCU,,,PreservedSpecimen,43b6767e-6eb7-432a-8a20-38e349c9f649,NCU00076215,162813,Plantae,Magnoliophyta,,Poales,Poaceae,Andropogon glomeratus var. pumilus ,14575,(Nash) Nash,Andropogon,glomeratus,var.,pumilus ,,,,,,,,,,,,,,,,,,,,,,,,,,,,,,,,,,United States,South Carolina,Kershaw,,,,,,34.33877918,-80.59028164,,,,,,,,,,,,,,,,en,wpmarinello,2/11/16 17:35,,206,urn:uuid:43b6767e-6eb7-432a-8a20-38e349c9f649,http://sernecportal.org/portal/collections/individual/index.php?occid=8531293
8531294,NCU,,,PreservedSpecimen,33936a36-a2d9-4545-b25e-1767395a444e,NCU00076216,150749,Plantae,Magnoliophyta,,Poales,Poaceae,Andropogon glomeratus var. pumilus ,14575,(Nash) Nash,Andropogon,glomeratus,var.,pumilus ,,,,,,,,,,,,,,,,,,,,,,,,,,,,,,,,,,United States,South Carolina,Kershaw,,,,,,34.33877918,-80.59028164,,,,,,,,,,,,,,,,en,wpmarinello,2/11/16 17:35,,206,urn:uuid:33936a36-a2d9-4545-b25e-1767395a444e,http://sernecportal.org/portal/collections/individual/index.php?occid=8531294
8531296,NCU,,,PreservedSpecimen,ee7b714f-1d1c-442b-a321-97d50e133430,NCU00076217,150753,Plantae,Magnoliophyta,,Poales,Poaceae,Andropogon glomeratus var. pumilus ,14575,(Nash) Nash,Andropogon,glomeratus,var.,pumilus ,,,,,,,,,,,,,,,,,,,,,,,,,,,,,,,,,,United States,South Carolina,Lancaster,,,,,,34.68675855,-80.70539952,,,,,,,,,,,,,,,,en,wpmarinello,2/11/16 17:35,,206,urn:uuid:ee7b714f-1d1c-442b-a321-97d50e133430,http://sernecportal.org/portal/collections/individual/index.php?occid=8531296
8531315,NCU,,,PreservedSpecimen,ee853069-e261-4de2-8b47-34430efbad83,NCU00076218,150750,Plantae,Magnoliophyta,,Poales,Poaceae,Andropogon glomeratus var. pumilus ,14575,(Nash) Nash,Andropogon,glomeratus,var.,pumilus ,,,,,,,,,,,,,,,,,,,,,,,,,,,,,,,,,,United States,South Carolina,Laurens,,,,,,34.48363228,-82.00597854,,,,,,,,,,,,,,,,en,wpmarinello,2/11/16 17:35,,206,urn:uuid:ee853069-e261-4de2-8b47-34430efbad83,http://sernecportal.org/portal/collections/individual/index.php?occid=8531315
8531318,NCU,,,PreservedSpecimen,e4ccbbc3-2e69-4ec1-abe0-ab0004c62342,NCU00076219,152560,Plantae,Magnoliophyta,,Poales,Poaceae,Andropogon glomeratus var. pumilus ,14575,(Nash) Nash,Andropogon,glomeratus,var.,pumilus ,,,,,,,,,,,,,,,,,,,,,,,,,,,,,,,,,,United States,South Carolina,Lexington,,,,,,33.9022482,-81.27218683,,,,,,,,,,,,,,,,en,wpmarinello,2/11/16 17:35,,206,urn:uuid:e4ccbbc3-2e69-4ec1-abe0-ab0004c62342,http://sernecportal.org/portal/collections/individual/index.php?occid=8531318
8531319,NCU,,,PreservedSpecimen,bee1a4fd-fe61-407a-9949-d4ff5d03758f,NCU00076223,150755,Plantae,Magnoliophyta,,Poales,Poaceae,Andropogon glomeratus var. pumilus ,14575,(Nash) Nash,Andropogon,glomeratus,var.,pumilus ,,,,,,,,,,,,,,,,,,,,,,,,,,,,,,,,,,United States,South Carolina,McCormick,,,,,,33.89958322,-82.30987745,,,,,,,,,,,,,,,,en,wpmarinello,2/11/16 17:35,,206,urn:uuid:bee1a4fd-fe61-407a-9949-d4ff5d03758f,http://sernecportal.org/portal/collections/individual/index.php?occid=8531319
8531321,NCU,,,PreservedSpecimen,bc591e1a-d939-49de-9f7a-0a14d2a05d29,NCU00076224,150756,Plantae,Magnoliophyta,,Poales,Poaceae,Andropogon glomeratus var. pumilus ,14575,(Nash) Nash,Andropogon,glomeratus,var.,pumilus ,,,,,,,,,,,,,,,,,,,,,,,,,,,,,,,,,,United States,South Carolina,Newberry,,,,,,34.28982188,-81.60013301,,,,,,,,,,,,,,,,en,wpmarinello,2/11/16 17:35,,206,urn:uuid:bc591e1a-d939-49de-9f7a-0a14d2a05d29,http://sernecportal.org/portal/collections/individual/index.php?occid=8531321
8531322,NCU,,,PreservedSpecimen,26232cd8-cd8a-4fd7-aaee-6c22b72c4cc9,NCU00076225,150170,Plantae,Magnoliophyta,,Poales,Poaceae,Andropogon glomeratus var. pumilus ,14575,(Nash) Nash,Andropogon,glomeratus,var.,pumilus ,,,,,,,,,,,,,,,,,,,,,,,,,,,,,,,,,,United States,South Carolina,Orangeburg,,,,,,33.43900587,-80.80033494,,,,,,,,,,,,,,,,en,wpmarinello,2/11/16 17:35,,206,urn:uuid:26232cd8-cd8a-4fd7-aaee-6c22b72c4cc9,http://sernecportal.org/portal/collections/individual/index.php?occid=8531322
8531325,NCU,,,PreservedSpecimen,68e16bfd-a6db-4e2c-88b7-bc3869669518,NCU00076226,150173,Plantae,Magnoliophyta,,Poales,Poaceae,Andropogon glomeratus var. pumilus ,14575,(Nash) Nash,Andropogon,glomeratus,var.,pumilus ,,,,,,,,,,,,,,,,,,,,,,,,,,,,,,,,,,United States,South Carolina,Saluda,,,,,,34.00613574,-81.72687768,,,,,,,,,,,,,,,,en,wpmarinello,2/11/16 17:35,,206,urn:uuid:68e16bfd-a6db-4e2c-88b7-bc3869669518,http://sernecportal.org/portal/collections/individual/index.php?occid=8531325
8531329,NCU,,,PreservedSpecimen,80e885df-2be2-42b1-9644-819b7fc56881,NCU00076228,85432,Plantae,Magnoliophyta,,Poales,Poaceae,Andropogon glomeratus var. pumilus ,14575,(Nash) Nash,Andropogon,glomeratus,var.,pumilus ,,,,,,,,,,,,,,,,,,,,,,,,,,,,,,,,,,United States,South Carolina,Union,,,,,,34.68923891,-81.61940081,,,,,,,,,,,,,,,,en,wpmarinello,2/11/16 17:35,,206,urn:uuid:80e885df-2be2-42b1-9644-819b7fc56881,http://sernecportal.org/portal/collections/individual/index.php?occid=8531329
8531330,NCU,,,PreservedSpecimen,4f527093-3b42-492c-a1d0-c6fa6279e97b,NCU00076229,150178,Plantae,Magnoliophyta,,Poales,Poaceae,Andropogon glomeratus var. pumilus ,14575,(Nash) Nash,Andropogon,glomeratus,var.,pumilus ,,,,,,,,,,,,,,,,,,,,,,,,,,,,,,,,,,United States,South Carolina,Williamsburg,,,,,,33.61992702,-79.72771383,,,,,,,,,,,,,,,,en,wpmarinello,2/11/16 17:35,,206,urn:uuid:4f527093-3b42-492c-a1d0-c6fa6279e97b,http://sernecportal.org/portal/collections/individual/index.php?occid=8531330
8584991,NCU,,,PreservedSpecimen,4efd06a0-dc64-4d84-8bc8-fd76176aa571,NCU00175445,,Plantae,Magnoliophyta,,Poales,Poaceae,Andropogon glomeratus var. pumilus ,14575,(Nash) Nash,Andropogon,glomeratus,var.,pumilus ,,,,,,,,,,,,,,,,,,,,,,,,,,,,,,,,,,United States,North Carolina,Moore,,,,,,35.31069142,-79.48133651,,,,,,,,,,,,,,,,en,ariellegarrett,3/2/16 11:50,,206,urn:uuid:4efd06a0-dc64-4d84-8bc8-fd76176aa571,http://sernecportal.org/portal/collections/individual/index.php?occid=8584991
8584994,NCU,,,PreservedSpecimen,cbd6ea2b-b8a5-47bb-9c80-5b885075c105,NCU00175446,,Plantae,Magnoliophyta,,Poales,Poaceae,Andropogon glomeratus var. pumilus ,14575,(Nash) Nash,Andropogon,glomeratus,var.,pumilus ,,,,,,,,,,,,,,,,,,,,,,,,,,,,,,,,,,United States,North Carolina,Moore,,,,,,35.31069142,-79.48133651,,,,,,,,,,,,,,,,en,ariellegarrett,3/2/16 11:50,,206,urn:uuid:cbd6ea2b-b8a5-47bb-9c80-5b885075c105,http://sernecportal.org/portal/collections/individual/index.php?occid=8584994
10429486,NCU,,,PreservedSpecimen,25184a7b-12db-45c8-97b1-ebabbc12dbb0,NCU00076227,150175,Plantae,Magnoliophyta,,Poales,Poaceae,Andropogon glomeratus var. pumilus ,14575,(Nash) Nash,Andropogon,glomeratus,var.,pumilus ,"Sorrie, B. A.",2015-00-00,,,synonym = Andropogon glomeratus (Walter) B.S.P. var. pumilus Vasey,,,"Bell, C. Ritchie",,10372,10/5/57,1957,10,5,278,,,,Red clay banks,,,,,,,,,,,,,,,United States,South Carolina,Spartanburg,,by small cemetary [sic; cemetery] east of Boiling Springs,,0,,34.93130165,-81.99067369,,,,,,,,,,,,,,,,en,wpmarinello,11/2/16 15:52,,206,urn:uuid:25184a7b-12db-45c8-97b1-ebabbc12dbb0,http://sernecportal.org/portal/collections/individual/index.php?occid=10429486
7925409,NCU,,,PreservedSpecimen,bdf65ebf-2a37-4eea-8acc-bbc2db1c59cf,NCU00078671,513020,Plantae,Magnoliophyta,,Poales,Poaceae,Andropogon virginicus,48572,L.,Andropogon,virginicus,,,"Thomas, Joab L.",1967,,,,,,"Thomas, Joab L.",,1232,10/7/67,1967,10,7,280,,,,Roadside and surrounding fields.,,Common,,,,,,,,,,,,,United States,Alabama,Hale,,Six miles south of Greensboro on Hwy 25. Roadside and surrounding fields.,,0,,32.76268954,-87.62911089,,,,,,,,,,,,,,,,en,Philip Straughn,10/25/16 15:16,,206,urn:uuid:bdf65ebf-2a37-4eea-8acc-bbc2db1c59cf,http://sernecportal.org/portal/collections/individual/index.php?occid=7925409
7925415,NCU,,,PreservedSpecimen,c45fdddc-2974-499e-be31-e3791adc8f66,NCU00078672,426670,Plantae,Magnoliophyta,,Poales,Poaceae,Andropogon virginicus,48572,L.,Andropogon,virginicus,,,"Campbell, C. S.",1980-06-00,,"""Revision of the Andropogon virginicus complex""",,,,"Kapa, Milton",,6,10/2/71,1971,10,2,275,,,,,,,,,,,,,,,,,,,United States,Alabama,Lee,,"20.3 miles NE of Auburn on US Hwy. 29, bordering a field owned by John C. Crutchfield",,,,32.6011835,-85.3556116,,,,,,,,,,,,,,,,en,Philip Straughn,10/25/16 15:16,,206,urn:uuid:c45fdddc-2974-499e-be31-e3791adc8f66,http://sernecportal.org/portal/collections/individual/index.php?occid=7925415
7925423,NCU,,,PreservedSpecimen,6a037459-8403-4a95-8021-997755ea6243,NCU00078688,260017,Plantae,Magnoliophyta,,Poales,Poaceae,Andropogon virginicus,48572,L.,Andropogon,virginicus,,,"Campbell, C. S.",1980-06-00,,"the old-field variant, ""A Revision of the Andropogon virginicus complex""",,,,"Bostick, Peter Edward",,249-9,10/6/62,1962,10,6,279,,,"A Geobotanical Investigation of Chandler Mountain, St. Clair Co., ALABAMA",Low wet area,,,,,,,,,,,,,,,United States,Alabama,Saint Clair,,"Low wet area, top of Chandler Mt.",,,,33.71570238,-86.31470127,,2000,,ShannaOberreiter (2017-05-04 10:07:52),,georef batch tool 2017-05-04; GeoLocate,reviewed - high confidence,maps to Chandler Mountain,,,,,,,,en,Philip Straughn,3/22/18 11:54,,206,urn:uuid:6a037459-8403-4a95-8021-997755ea6243,http://sernecportal.org/portal/collections/individual/index.php?occid=7925423
7925436,NCU,,,PreservedSpecimen,1c0bfe14-0aa7-49d3-9ffb-6f43428bd371,NCU00078692,493082,Plantae,Magnoliophyta,,Poales,Poaceae,Andropogon virginicus,48572,L.,Andropogon,virginicus,,,"Correll, D. S.; Popenoe, John",1978,,,,,,"Popenoe, Joe","Correll, D. S.",50102,8/26/78,1978,8,26,238,,,,in open area along roadway through pinelands,,In small clumps.,,,,,,,,,,,,,United States,Florida,Miami Dade,,"Deering Estate, Cutler, in open area along roadway through pinelands.",,,,25.6171109,-80.56822009,,,,,,,,,,,,,,,,en,Philip Straughn,10/25/16 15:16,,206,urn:uuid:1c0bfe14-0aa7-49d3-9ffb-6f43428bd371,http://sernecportal.org/portal/collections/individual/index.php?occid=7925436
7925450,NCU,,,PreservedSpecimen,43cdbaef-2e41-4841-beb2-23e7657fb3c5,NCU00078697,538982,Plantae,Magnoliophyta,,Poales,Poaceae,Andropogon virginicus,48572,L.,Andropogon,virginicus,,,"Anderson, Loran C.",1982,,,,,,"Anderson, Loran C.",,5648,2/5/82,1982,2,5,36,,,,DOG ISLAND: Frequent in moist sandy soil of opening in pine-oak woodland,,,,,,,,,,,,,,,United States,Florida,Franklin,,DOG ISLAND: Frequent in moist sandy soil of opening in pine-oak woodland of The Interior W of Tysons Harbor and N of the abandoned dump.,,,,29.87727793,-84.81716901,,,,,,,,,,,,,,,,en,Philip Straughn,10/25/16 15:16,,206,urn:uuid:43cdbaef-2e41-4841-beb2-23e7657fb3c5,http://sernecportal.org/portal/collections/individual/index.php?occid=7925450
7925501,NCU,,,PreservedSpecimen,b68c9aa0-71df-4bbd-a603-01d48f9b3595,NCU00078606,470907,Plantae,Magnoliophyta,,Poales,Poaceae,Andropogon virginicus,48572,L.,Andropogon,virginicus,,,"Brumbach, W. C.",1974,,,,,,"Brumbach, W. C.",,8648,10/21/74,1974,10,21,294,,,,Old fields,,"Plants in clumps, of upright habit",,,,,,,,,,,,,United States,Florida,Lee,,Old fields; Western Sanibel,,,,26.5785659,-81.82101183,,,,,,,,,,,,,,,,en,Philip Straughn,10/25/16 15:16,,206,urn:uuid:b68c9aa0-71df-4bbd-a603-01d48f9b3595,http://sernecportal.org/portal/collections/individual/index.php?occid=7925501
7925519,NCU,,,PreservedSpecimen,962a13d5-ed57-4cd1-aaae-21f8bb3cccc3,NCU00078612,502486,Plantae,Magnoliophyta,,Poales,Poaceae,Andropogon virginicus,48572,L.,Andropogon,virginicus,,,"Breland, Glen E.",1970,,,,,,"Breland, Glen E.",,127,11/14/70,1970,11,14,318,,,,,,,,,,,,,,,,,,,United States,Florida,Pasco,,"Alongside orange grove fence-row, 0.3 mi W on Askel Rd. at jct of hwy US-41. COASTAL PLAIN PROVINCE.",,,,28.30927719,-82.39115133,,,,,,,,,,,,,,,,en,Philip Straughn,10/25/16 15:16,,206,urn:uuid:962a13d5-ed57-4cd1-aaae-21f8bb3cccc3,http://sernecportal.org/portal/collections/individual/index.php?occid=7925519
7925525,NCU,,,PreservedSpecimen,5ff1a299-36c3-4110-a7f2-7e78afcb2053,NCU00078614,205087,Plantae,Magnoliophyta,,Poales,Poaceae,Andropogon virginicus,48572,L.,Andropogon,virginicus,,,"Campbell, C. S.",1980-06-00,,,,,,"Lakela, O.",,23585,11/11/60,1960,11,11,316,,,,"Growing among tall plants of Andropogon, low terrace of Lake Iris. White sandy soil, Quercus Pinus cover. Hesperides,",,,,,,,,,,,,,,,United States,Florida,Polk,,"Growing among tall plants of Andropogon, low terrace of Lake Iris. 8 miles east of Lake Wales.",,,,27.94887707,-81.69775899,,,,,,,,,,,,,,,,en,Philip Straughn,10/25/16 15:16,,206,urn:uuid:5ff1a299-36c3-4110-a7f2-7e78afcb2053,http://sernecportal.org/portal/collections/individual/index.php?occid=7925525
7925527,NCU,,,PreservedSpecimen,3ecdce9c-00ad-4a29-bddb-53cc1821f447,NCU00078616,275469,Plantae,Magnoliophyta,,Poales,Poaceae,Andropogon virginicus,48572,L.,Andropogon,virginicus,,,,,,,,,,,,,,,,,,,,,,,,,,,,,,,,,,,,United States,Florida,Wakulla,,,,,,30.17031212,-84.40264545,,,,,,,,,,,,,,,,en,Philip Straughn,10/25/16 15:16,,206,urn:uuid:3ecdce9c-00ad-4a29-bddb-53cc1821f447,http://sernecportal.org/portal/collections/individual/index.php?occid=7925527
7925547,NCU,,,PreservedSpecimen,0e3e7a71-05a3-4812-98f6-0e28d1fb8b7b,NCU00078618,474023,Plantae,Magnoliophyta,,Poales,Poaceae,Andropogon virginicus,48572,L.,Andropogon,virginicus,,,,,,,,,,,,,,,,,,,,,,,,,,,,,,,,,,,,United States,Georgia,Dade,,,,,,34.85458014,-85.50451975,,,,,,,,,,,,,,,,en,Philip Straughn,10/25/16 15:16,,206,urn:uuid:0e3e7a71-05a3-4812-98f6-0e28d1fb8b7b,http://sernecportal.org/portal/collections/individual/index.php?occid=7925547
7925556,NCU,,,PreservedSpecimen,09173c1e-edcb-4b74-bee4-66e120084dee,NCU00078621,581010,Plantae,Magnoliophyta,,Poales,Poaceae,Andropogon virginicus,48572,L.,Andropogon,virginicus,,,"Breland, Glen E.",1970,,,,,,"Breland, Glen E.",,55,10/22/70,1970,10,22,295,,,,Margin of floodplain of intermittent pond,,,,,,,,,,,,,,,United States,Georgia,Brooks,,"Margin of floodplain of intermittent pond, 13.6 mi. NNE of Quitman on hwy Ga-76. COASTAL PLAIN PROVINCE",,,,30.84196295,-83.58032178,,,,,,,,,,,,,,,,en,Philip Straughn,10/25/16 15:16,,206,urn:uuid:09173c1e-edcb-4b74-bee4-66e120084dee,http://sernecportal.org/portal/collections/individual/index.php?occid=7925556
7925563,NCU,,,PreservedSpecimen,bd0091ff-92de-4629-91a8-fce6756d0f48,NCU00078623,286819,Plantae,Magnoliophyta,,Poales,Poaceae,Andropogon virginicus,48572,L.,Andropogon,virginicus,,,,,,,,,,,,,,,,,,,,,,,,,,,,,,,,,,,,United States,Georgia,Bulloch,,,,,,32.39693801,-81.74317714,,,,,,,,,,,,,,,,en,Philip Straughn,10/25/16 15:16,,206,urn:uuid:bd0091ff-92de-4629-91a8-fce6756d0f48,http://sernecportal.org/portal/collections/individual/index.php?occid=7925563
7925583,NCU,,,PreservedSpecimen,001cffe4-c5e2-482a-bbf3-ced8379dace7,NCU00078626,502499,Plantae,Magnoliophyta,,Poales,Poaceae,Andropogon virginicus,48572,L.,Andropogon,virginicus,,,"Breland, Glen E.",1970,,,,,,"Breland, Glen E.",,32,10/22/70,1970,10,22,295,,,,Soil dry and sandy,,,,,,,,,,,,,,,United States,Georgia,Cook,,"Roadside, weedy area - 0.8 mi N of Cook-Lowndes County line. Soil dry and sandy. COASTAL PLAIN PROVINCE",,,,31.1539963,-83.43049856,,,,,,,,,,,,,,,,en,Philip Straughn,10/25/16 15:16,,206,urn:uuid:001cffe4-c5e2-482a-bbf3-ced8379dace7,http://sernecportal.org/portal/collections/individual/index.php?occid=7925583
7925590,NCU,,,PreservedSpecimen,b7787cdd-1a12-44dc-bd7f-095b6451e015,NCU00078628,549574,Plantae,Magnoliophyta,,Poales,Poaceae,Andropogon virginicus,48572,L.,Andropogon,virginicus,,,"Carter, Douglas R.",1979,,,,,,"Credle, Walter C.","Fairey, III, John E.; Douglass, Caroline C.",2650,10/10/79,1979,10,10,283,,,"""Vegetational Survey of Richard B. Russell Dam and Lake Area""",In field; on floodplain,,Below 475-ft. contour (full pool for proposed Russell Lake). Area to be impounded in mid-1980s.,,,,,,,,,,,,,United States,Georgia,Elbert,,"In field; on floodplain of Savannah River. Site #90 (Lat. 3409'30''; Long. 8243'19''), ca. 1.5 miles south of confluence of Coldwater Creek with the Savannah; ca. 4 miles east-southeast of community of Ruckersville, Ga. Below 475-ft. contour (full pool for proposed Russell Lake).",,,,34.11694673,-82.84030309,WGS84,2000,"34 09' 30"" N 82 43' 19"" W","Credle, Walter C.",,,,lat/long on original label,,,,,,,,en,Philip Straughn,10/25/16 15:16,,206,urn:uuid:b7787cdd-1a12-44dc-bd7f-095b6451e015,http://sernecportal.org/portal/collections/individual/index.php?occid=7925590
7925599,NCU,,,PreservedSpecimen,21182cd5-fb38-4172-b971-f386638ab5f3,NCU00078631,504802,Plantae,Magnoliophyta,,Poales,Poaceae,Andropogon virginicus,48572,L.,Andropogon,virginicus,,,"Coile, Nancy Craft",1978,,,,,,"Coile, Nancy Craft","Coile, Danielle; Coile, Robert",2089,11/5/78,1978,11,5,309,,,,Growing at edge of pine woods in red clay soil.,,,,,,,,,,,,,,,United States,Georgia,Elbert,,"S of Elberton, off Jones Ferry Road. Growing at edge of pine woods in red clay soil.",,,,34.11694673,-82.84030309,,,,,,,,,,,,,,,,en,Philip Straughn,10/25/16 15:16,,206,urn:uuid:21182cd5-fb38-4172-b971-f386638ab5f3,http://sernecportal.org/portal/collections/individual/index.php?occid=7925599
7925615,NCU,,,PreservedSpecimen,3942c822-cd7f-46ba-842a-d79efdf0b14b,NCU00078635,502501,Plantae,Magnoliophyta,,Poales,Poaceae,Andropogon virginicus,48572,L.,Andropogon,virginicus,,,"Breland, Glen E.",1970,,,,,,"Breland, Glen E.",,1,10/9/70,1970,10,9,282,,,,Margin of intermittent cypress pond,,,,,,,,,,,,,,,United States,Georgia,Lowndes,,"Margin of intermittent cypress pond, 1.8 mi NW on North Valdosta Rd. from intersection with I-75. COASTAL PLAIN PROVINCE",,,,30.83387937,-83.2677379,,,,,,,,,,,,,,,,en,Philip Straughn,10/25/16 15:16,,206,urn:uuid:3942c822-cd7f-46ba-842a-d79efdf0b14b,http://sernecportal.org/portal/collections/individual/index.php?occid=7925615
7925627,NCU,,,PreservedSpecimen,ade6e57e-5eb6-4e8f-943b-2c5712199334,NCU00078639,515525,Plantae,Magnoliophyta,,Poales,Poaceae,Andropogon virginicus,48572,L.,Andropogon,virginicus,,,"Hill, Joscelyn W.",1978,,,,,,"Hill, Joscelyn W.",,817,11/5/78,1978,11,5,309,,,,,,3.5 to 4 feet tall.,,,,,,,,,,,,,United States,Georgia,Morgan,,"Flora of Hard Labor Creek State Park. 2 Mi. N. of Rutledge. Back road in park, under powerlines.",,,,33.59081648,-83.49240897,,,,,,,,,,,,,,,,en,Philip Straughn,10/25/16 15:16,,206,urn:uuid:ade6e57e-5eb6-4e8f-943b-2c5712199334,http://sernecportal.org/portal/collections/individual/index.php?occid=7925627
7925678,NCU,,,PreservedSpecimen,f0f39599-7219-4370-97e2-78af93fa70aa,NCU00078629,16553,Plantae,Magnoliophyta,,Poales,Poaceae,Andropogon virginicus,48572,L.,Andropogon,virginicus,,,,,,,,,,,,,,,,,,,,,,,,,,,,,,,,,,,,United States,Mississippi,Harrison,,,,,,30.51500982,-89.11854318,,,,,,,,,,,,,,,,en,Philip Straughn,10/25/16 15:16,,206,urn:uuid:f0f39599-7219-4370-97e2-78af93fa70aa,http://sernecportal.org/portal/collections/individual/index.php?occid=7925678
7925684,NCU,,,PreservedSpecimen,5cb36e5c-f2be-4c0f-89e8-511a2d87c874,NCU00078648,16613,Plantae,Magnoliophyta,,Poales,Poaceae,Andropogon virginicus,48572,L.,Andropogon,virginicus,,,,,,,,,,,,,,,,,,,,,,,,,,,,,,,,,,,,United States,Mississippi,Harrison,,,,,,30.51500982,-89.11854318,,,,,,,,,,,,,,,,en,Philip Straughn,10/25/16 15:16,,206,urn:uuid:5cb36e5c-f2be-4c0f-89e8-511a2d87c874,http://sernecportal.org/portal/collections/individual/index.php?occid=7925684
7925685,NCU,,,PreservedSpecimen,470693a0-1ea3-4d04-a370-7b49501ffd4c,NCU00078649,16612,Plantae,Magnoliophyta,,Poales,Poaceae,Andropogon virginicus,48572,L.,Andropogon,virginicus,,,,,,,,,,,,,,,,,,,,,,,,,,,,,,,,,,,,United States,Mississippi,Harrison,,,,,,30.51500982,-89.11854318,,,,,,,,,,,,,,,,en,Philip Straughn,10/25/16 15:16,,206,urn:uuid:470693a0-1ea3-4d04-a370-7b49501ffd4c,http://sernecportal.org/portal/collections/individual/index.php?occid=7925685
7968306,NCU,,,PreservedSpecimen,db4336e9-bdda-4627-8e1a-3f99dc5cd27f,NCU00078659,459702,Plantae,Magnoliophyta,,Poales,Poaceae,Andropogon virginicus,48572,L.,Andropogon,virginicus,,,"Campbell, C. S.",1980-06-00,,,,,,"Warrington, Sarah J.",,410.3,10/19/68,1968,10,19,293,,,"""Vascular Flora of Tipton County, Tennessee""",Sand and gravel pits,,,,,,,,,,,,,,,United States,Tennessee,Shelby,,"Sand and gravel pits, 7.2 mi. N of Shelby Co. line on US 51 N.",,,,35.18368924,-89.89562381,,,,,,,,,,,,,,,,en,Philip Straughn,10/25/16 15:16,,206,urn:uuid:db4336e9-bdda-4627-8e1a-3f99dc5cd27f,http://sernecportal.org/portal/collections/individual/index.php?occid=7968306
7968311,NCU,,,PreservedSpecimen,8692bf9f-3a30-4ea9-aae6-a3d65a501725,NCU00028214,570842,Plantae,Magnoliophyta,,Poales,Poaceae,Andropogon virginicus,48572,L.,Andropogon,virginicus,,,,,,,,,,,,,,,,,,,,,,,,,,,,,,,,,,,,United States,Tennessee,Knox,,,,,,35.99324169,-83.93709473,,,,,,,,,,,,,,,,en,Philip Straughn,10/25/16 15:16,,206,urn:uuid:8692bf9f-3a30-4ea9-aae6-a3d65a501725,http://sernecportal.org/portal/collections/individual/index.php?occid=7968311
7968316,NCU,,,PreservedSpecimen,4133c86d-ee02-4f65-870b-89de57bc9d21,NCU00078660,488607,Plantae,Magnoliophyta,,Poales,Poaceae,Andropogon virginicus,48572,L.,Andropogon,virginicus,,,"Harvill, A. M.",1971,,,,,,"Eggers Ware, Donna M.",,3828,10/8/71,1971,10,8,281,,,,roadside,,,,,,,,,,,,,,,United States,Virginia,Charles City,,"Roadside on E side Rt. 605 (recently renumbered 658), about 0.5 mi. S of its jct. with Rt. 607 near community of Wayside.",,,,37.35645663,-77.06127521,,,,,,,,,,,,,,,,en,Philip Straughn,10/25/16 15:16,,206,urn:uuid:4133c86d-ee02-4f65-870b-89de57bc9d21,http://sernecportal.org/portal/collections/individual/index.php?occid=7968316
7968318,NCU,,,PreservedSpecimen,9d25a9e3-94fb-48dd-8b52-9778e770eea7,NCU00078661,531037,Plantae,Magnoliophyta,,Poales,Poaceae,Andropogon virginicus,48572,L.,Andropogon,virginicus,,,,,,,,,,,,,,,,,,,,,,,,,,,,,,,,,,,,United States,Virginia,Fairfax,,,,,,38.83845347,-77.27879239,,,,,,,,,,,,,,,,en,Philip Straughn,10/25/16 15:16,,206,urn:uuid:9d25a9e3-94fb-48dd-8b52-9778e770eea7,http://sernecportal.org/portal/collections/individual/index.php?occid=7968318
7968320,NCU,,,PreservedSpecimen,50e372fc-348e-480a-9e81-23730e9f2171,NCU00078662,489796,Plantae,Magnoliophyta,,Poales,Poaceae,Andropogon virginicus,48572,L.,Andropogon,virginicus,,,"Harvill, A. M.",1975,,,,,,"Diggs, Jr., George M.",,1026,9/28/75,1975,9,28,271,,,,Growing in open hay field,,Very abundant,,,,,Dactylis glomerata,,,,,,,,United States,Virginia,Fluvanna,,"Growing in open hay field, just south of Rt. 607, 1/4 mile west of intersection with Rt. 696.",,,,37.84185097,-78.27743702,,,,,,,,,,,,,,,,en,Philip Straughn,10/25/16 15:16,,206,urn:uuid:50e372fc-348e-480a-9e81-23730e9f2171,http://sernecportal.org/portal/collections/individual/index.php?occid=7968320
7968322,NCU,,,PreservedSpecimen,e59727a2-8dfa-40d6-ae1b-6937b8b2def9,NCU00078664,348758,Plantae,Magnoliophyta,,Poales,Poaceae,Andropogon virginicus,48572,L.,Andropogon,virginicus,,,"Campbell, C. S.",1980-06-00,,"the old-field variant, ""A Revision of the Andropogon virginicus complex""",,,,"Barans, Allene",,696,10/12/68,1968,10,12,286,,,,In sandy soil at edge of woods,,,,,,,,,,,,,,,United States,Virginia,James City,,"In sandy soil at edge of woods at jct. of Mill Neck and Rt. 5, The College Woods, The College of William and Mary.",,,,37.32963018,-76.77821966,,,,,,,,,,,,,,,,en,Philip Straughn,10/25/16 15:16,,206,urn:uuid:e59727a2-8dfa-40d6-ae1b-6937b8b2def9,http://sernecportal.org/portal/collections/individual/index.php?occid=7968322
7968332,NCU,,,PreservedSpecimen,1d46f33e-c53c-407b-93a1-c0373ddf3366,NCU00078666,215547,Plantae,Magnoliophyta,,Poales,Poaceae,Andropogon virginicus,48572,L.,Andropogon,virginicus,,,,,,,,,,,,,,,,,,,,,,,,,,,,,,,,,,,,United States,Virginia,Suffolk City,,,,,,36.69258401,-76.64172386,,,,,,,,,,,,,,,,en,Philip Straughn,10/25/16 15:16,,206,urn:uuid:1d46f33e-c53c-407b-93a1-c0373ddf3366,http://sernecportal.org/portal/collections/individual/index.php?occid=7968332
7968341,NCU,,,PreservedSpecimen,7d2fe1a3-1f1f-4620-acb8-e474435f98cc,NCU00078668,465794,Plantae,Magnoliophyta,,Poales,Poaceae,Andropogon virginicus,48572,L.,Andropogon,virginicus,,,"Harvill, A. M.",unknown,,Verif. A.M. Harvill,,,,"Appler, Phyllis K.","Higgins, F.",936,10/5/73,1973,10,5,278,,,"ex. Warwick County now independent city state, Va.",By RR trestle next to marsh,,,,,,,,,,,,,,,United States,Virginia,Newport News City,,"By RR trestle next to marsh; on Harrison Rd. near sewage treatment plant, Fort Eustis.",,,,37.10506238,-76.51893763,,,,,,,,,,,,,,,,en,Philip Straughn,10/25/16 15:16,,206,urn:uuid:7d2fe1a3-1f1f-4620-acb8-e474435f98cc,http://sernecportal.org/portal/collections/individual/index.php?occid=7968341
7968342,NCU,,,PreservedSpecimen,caadea65-159f-4b7e-a5a7-4490794d3700,NCU00078669,466066,Plantae,Magnoliophyta,,Poales,Poaceae,Andropogon virginicus,48572,L.,Andropogon,virginicus,,,"Harvill, A. M.",1972,,,,,,"Appler, Phyllis K.","Eggers Ware, Donna M.",377,9/11/72,1972,9,11,255,,,,Open area under tall pines with deciduous understory beside trail,,,,,,,,,,,,,,,United States,Virginia,Newport News City,,"Open area under tall pines with deciduous understory beside trail; on peninsula carrying pipeline across Lake Eustis, Fort Eustis.",,,,37.10506238,-76.51893763,,,,,,,,,,,,,,,,en,Philip Straughn,10/25/16 15:16,,206,urn:uuid:caadea65-159f-4b7e-a5a7-4490794d3700,http://sernecportal.org/portal/collections/individual/index.php?occid=7968342
7968347,NCU,,,PreservedSpecimen,edc4bc96-d1c9-4253-a94f-af0edb26ce53,NCU00078801,465788,Plantae,Magnoliophyta,,Poales,Poaceae,Andropogon virginicus,48572,L.,Andropogon,virginicus,,,"Eggers Ware, Donna M.",1974,,,,,,"Eggers Ware, Donna M.",,6048a,9/25/74,1974,9,25,268,,,,Common at base of shoulder slope at beach border,,Common,,,,,,,,,,,,,United States,Virginia,Surry,,"Common at base of shoulder slope at beach border; immediately S of outflow canal, VEPCO Surry Nuclear Power Station; P.O. Surry.",,,,37.10885793,-76.90084576,,,,,,,,,,,,,,,,en,Philip Straughn,10/25/16 15:16,,206,urn:uuid:edc4bc96-d1c9-4253-a94f-af0edb26ce53,http://sernecportal.org/portal/collections/individual/index.php?occid=7968347
7968361,NCU,,,PreservedSpecimen,9bb38384-c5a8-4148-98f6-ad9958133a4f,NCU00086398,583569,Plantae,Magnoliophyta,,Poales,Poaceae,Andropogon virginicus,48572,L.,Andropogon,virginicus,,,"Richards, E. L",1972,,,,,,"Richards, Edward Leon",,6061,12/2/72,1972,12,2,337,,,,Along exposed bank in sandstone.,,,,,,,Aristida,,,,,,,,United States,Arkansas,Baxter,,Along exposed bank in sandstone. Norfork Dam Site.,,,,36.28721291,-92.3369694,,,,,,,,,,,,,,,,en,Philip Straughn,3/6/18 13:45,,206,urn:uuid:9bb38384-c5a8-4148-98f6-ad9958133a4f,http://sernecportal.org/portal/collections/individual/index.php?occid=7968361
7968364,NCU,,,PreservedSpecimen,32c8ffea-3aa1-42a3-a6f7-3f88fa68518b,NCU00086809,583490,Plantae,Magnoliophyta,,Poales,Poaceae,Andropogon virginicus,48572,L.,Andropogon,virginicus,,,"Richards, E. L",1973,,,,,,"Richards, Edward Leon",,6167,10/20/73,1973,10,20,293,,,,,,"Plants tall, growing with Aristida.",,,,,Aristida,,,,,,,,United States,Arkansas,Greene,,"Two and one half miles north and two and one half miles east of Walcott, Ark. T17N-R4E-S23",,,,36.11769254,-90.55911526,,,,,,,,,,,,,,,,en,Philip Straughn,3/6/18 13:45,,206,urn:uuid:32c8ffea-3aa1-42a3-a6f7-3f88fa68518b,http://sernecportal.org/portal/collections/individual/index.php?occid=7968364
7968369,NCU,,,PreservedSpecimen,c9132fe2-ec29-4eac-bc25-2546995ddba6,NCU00078809,357188,Plantae,Magnoliophyta,,Poales,Poaceae,Andropogon virginicus,48572,L.,Andropogon,virginicus,,,,,,,,,,,,,,,,,,,,,,,,,,,,,,,,,,,,United States,District of Columbia,,,,,,,,,,,,,,,,,,,,,,,,en,Philip Straughn,10/25/16 15:16,,206,urn:uuid:c9132fe2-ec29-4eac-bc25-2546995ddba6,http://sernecportal.org/portal/collections/individual/index.php?occid=7968369
7968370,NCU,,,PreservedSpecimen,8ac88992-9a26-405d-8def-15df10974095,NCU00078812,567492,Plantae,Magnoliophyta,,Poales,Poaceae,Andropogon virginicus,48572,L.,Andropogon,virginicus,,,,,,,,,,,,,,,,,,,,,,,,,,,,,,,,,,,,United States,District of Columbia,,,,,,,,,,,,,,,,,,,,,,,,en,Philip Straughn,10/25/16 15:16,,206,urn:uuid:8ac88992-9a26-405d-8def-15df10974095,http://sernecportal.org/portal/collections/individual/index.php?occid=7968370
7968373,NCU,,,PreservedSpecimen,08f79bbc-6dbc-4762-8abe-7a42ce47bb27,NCU00078814,514096,Plantae,Magnoliophyta,,Poales,Poaceae,Andropogon virginicus,48572,L.,Andropogon,virginicus,,,"Buddell, II, George F.",1980,,,,,,"Buddell II, George F.",,245,9/20/80,1980,9,20,264,,,,,,Common,,,,,other grasses and some sedges.,,,,,,,,United States,Kentucky,Campbell,,Growing in clearing near the int. of Rt. 8 and Rt. 1998 in Silver Grove.,,,,38.94647208,-84.37934227,,,,,,,,,,,,,,,,en,Philip Straughn,10/25/16 15:16,,206,urn:uuid:08f79bbc-6dbc-4762-8abe-7a42ce47bb27,http://sernecportal.org/portal/collections/individual/index.php?occid=7968373
7968374,NCU,,,PreservedSpecimen,b49a9bc7-75d1-40cd-b60d-7d44b2825894,NCU00078815,538480,Plantae,Magnoliophyta,,Poales,Poaceae,Andropogon virginicus,48572,L.,Andropogon,virginicus,,,"Wilson, Larry M.",1975,,,,,,"Wilson, Larry M.",,1213,9/26/75,1975,9,26,269,,,,"Steep, north-facing wooded slope",,,,,,,,,,,,,,,United States,Kentucky,Carlisle,,"Sandy Branch, Carlisle Co., 7.1 km. WSW Bardwell, 2.2 km. SE Laketon; Alt. 131 +/- 6 m (430 +/- 20 ft.)",,,,36.8531859,-88.9709094,WGS84,2000,,,,,,,,,,,,,,en,Philip Straughn,5/29/18 0:09,,206,urn:uuid:b49a9bc7-75d1-40cd-b60d-7d44b2825894,http://sernecportal.org/portal/collections/individual/index.php?occid=7968374
7968375,NCU,,,PreservedSpecimen,18ced7e4-9640-43f8-9f96-2874472d6455,NCU00078827,538483,Plantae,Magnoliophyta,,Poales,Poaceae,Andropogon virginicus,48572,L.,Andropogon,virginicus,,,"Wilson, Larry M.",1975,,,,,,"Wilson, Larry M.",,1198,9/19/75,1975,9,19,262,,,,"Steep, west-facing, cut-over, wooded slope",,,,,,,,,,,,,,,United States,Kentucky,Carlisle,,"Sandy Branch, Carlisle Co., 7.1 km. WSW Bardwell, 2.2 km. SE Laketon; Alt. 131 +/- 6 m (430 +/- 20 ft.)",,,,36.8531859,-88.9709094,WGS84,2000,,"Wilson, Larry M.",,,,lat/long on original label,,,,,,,,en,Philip Straughn,5/29/18 0:09,,206,urn:uuid:18ced7e4-9640-43f8-9f96-2874472d6455,http://sernecportal.org/portal/collections/individual/index.php?occid=7968375
7968376,NCU,,,PreservedSpecimen,22eac43a-33b6-49b7-95d8-c7dcfd6171fb,NCU00078816,538539,Plantae,Magnoliophyta,,Poales,Poaceae,Andropogon virginicus,48572,L.,Andropogon,virginicus,,,"Bryan, Charlotte",1975,,,,,,"Bryan, Charlotte",,736,11/8/75,1975,11,8,312,,,,Ravine Habitat.,,,,,,,,,,,,,,,United States,Kentucky,Hickman,,Hickman County: 2.8 km S. of Columbus & 6.5 km NW of Harlwell: 0.5 km E. of Mississippi River. Ravine Habitat.,,,,36.67811834,-88.97614891,,,,,,,,,,,,,,,,en,Philip Straughn,10/25/16 15:16,,206,urn:uuid:22eac43a-33b6-49b7-95d8-c7dcfd6171fb,http://sernecportal.org/portal/collections/individual/index.php?occid=7968376
7968378,NCU,,,PreservedSpecimen,36019586-a04f-43af-80f8-73e6a97952fd,NCU00078817,521625,Plantae,Magnoliophyta,,Poales,Poaceae,Andropogon virginicus,48572,L.,Andropogon,virginicus,,,"Buddell, II, George F.",1983,,,,,,"Buddell II, George F.",,3263,9/24/83,1983,9,24,267,,,,Common on weedy hillside,,,,,,,,,,,,,,,United States,Kentucky,Lewis,,Common on weedy hillside along road in playground-park at west end of Vanceburg on Rt. 8.,,,,38.53165566,-83.37814408,,,,,,,,,,,,,,,,en,Philip Straughn,10/25/16 15:16,,206,urn:uuid:36019586-a04f-43af-80f8-73e6a97952fd,http://sernecportal.org/portal/collections/individual/index.php?occid=7968378
7968380,NCU,,,PreservedSpecimen,f9890885-701d-49ba-b10c-b51cf64d8c81,NCU00078818,514267,Plantae,Magnoliophyta,,Poales,Poaceae,Andropogon virginicus,48572,L.,Andropogon,virginicus,,,"Sole, Jeffery D.",1978,,,,,,"Sole, Jeffery D.",,571,9/29/78,1978,9,29,272,,,,slope old field community,,,,,,,,,,,,,,,United States,Kentucky,Letcher,,"Lilley Cornett Woods Appalachian Ecological Research Station, southwest of Whitesburg near Skyline, about 8 miles south-east of KY 7 on Route 1103.",,,,37.12116375,-82.85530096,WGS84,3036,,"McCormick, Carol Ann",,GeoLocate,,#NAME?,,,,,,,,en,Philip Straughn,1/27/17 16:14,,206,urn:uuid:f9890885-701d-49ba-b10c-b51cf64d8c81,http://sernecportal.org/portal/collections/individual/index.php?occid=7968380
7968387,NCU,,,PreservedSpecimen,d0162952-f41e-4222-a67e-6f44cf38b28e,NCU00078820,525744,Plantae,Magnoliophyta,,Poales,Poaceae,Andropogon virginicus,48572,L.,Andropogon,virginicus,,,"Buddell, II, George F.",1983,,,,,,"Buddell II, George F.",,3205,9/10/83,1983,9,10,253,,,,"Common in low, weedy area",,,,,,,,,,,,,,,United States,Kentucky,Pendleton,,"Common in low, weedy area along Rt. 27 in Falmouth.",,,,38.6956621,-84.36017165,,,,,,,,,,,,,,,,en,Philip Straughn,10/25/16 15:16,,206,urn:uuid:d0162952-f41e-4222-a67e-6f44cf38b28e,http://sernecportal.org/portal/collections/individual/index.php?occid=7968387
7968389,NCU,,,PreservedSpecimen,28290666-9ff0-4653-baaa-a3282d725162,NCU00078821,527196,Plantae,Magnoliophyta,,Poales,Poaceae,Andropogon virginicus,48572,L.,Andropogon,virginicus,,,"Levy, Foster",1982,,,,,,"Levy, Foster",,s. n.,9/18/82,1982,9,18,261,,,,,,Little Bluestem,,,,,,,,,,,,,United States,Kentucky,Pike,,"road edge 1/2 mile up holler, 1/2 mile south of Gins Fork of Brushy Creek",,,,37.46904567,-82.39577878,,,,,,,,,,,,,,,,en,Philip Straughn,10/25/16 15:16,,206,urn:uuid:28290666-9ff0-4653-baaa-a3282d725162,http://sernecportal.org/portal/collections/individual/index.php?occid=7968389
7968392,NCU,,,PreservedSpecimen,8030cae8-1a72-47df-8874-f768d8ac7b79,NCU00078822,526746,Plantae,Magnoliophyta,,Poales,Poaceae,Andropogon virginicus,48572,L.,Andropogon,virginicus,,,"Levy, Foster",1982,,,,,,"Levy, Foster",,s. n.,5/20/82,1982,5,20,140,,,,flat open strip mined area,,Broom sedge,,,,,,,,,,,,,United States,Kentucky,Pike,,flat open strip mined area at top of Dorton Flatwoods,,,,37.46904567,-82.39577878,,,,,,,,,732,,,,,2400 ',,en,Philip Straughn,10/25/16 15:16,,206,urn:uuid:8030cae8-1a72-47df-8874-f768d8ac7b79,http://sernecportal.org/portal/collections/individual/index.php?occid=7968392
7968396,NCU,,,PreservedSpecimen,276d0013-e144-4af4-8c6f-361e4a1eb271,NCU00078824,415245,Plantae,Magnoliophyta,,Poales,Poaceae,Andropogon virginicus,48572,L.,Andropogon,virginicus,,,"Campbell, C. S.",1980-06-00,,"the old-field variant, ""A Revision of the Andropogon virginicus complex""",,,,"Brown, Melvin",,s. n.,9/19/71,1971,9,19,262,,,,,,,,,,,,,,,,,,,United States,Maryland,Allegany,,McCoole,,,,39.62150591,-78.69895605,,,,,,,,,,,,,,,,en,Philip Straughn,10/25/16 15:16,,206,urn:uuid:276d0013-e144-4af4-8c6f-361e4a1eb271,http://sernecportal.org/portal/collections/individual/index.php?occid=7968396
8530723,NCU,,,PreservedSpecimen,551d8816-4c7c-40e8-a064-a42b170fca7d,NCU00089752,582828,Plantae,Magnoliophyta,,Poales,Poaceae,Andropogon virginicus,48572,L.,Andropogon,virginicus,,,,,,,,,,,,,,,,,,,,,,,,,,,,,,,,,,,,United States,North Carolina,Ashe,,,,,,36.43461383,-81.50103824,,,,,,,,,,,,,,,,en,wpmarinello,10/25/16 15:16,,206,urn:uuid:551d8816-4c7c-40e8-a064-a42b170fca7d,http://sernecportal.org/portal/collections/individual/index.php?occid=8530723
8530725,NCU,,,PreservedSpecimen,6bb43316-0ec9-4bc7-a28c-c1284630cc99,NCU00075778,508956,Plantae,Magnoliophyta,,Poales,Poaceae,Andropogon virginicus,48572,L.,Andropogon,virginicus,,,,,,,,,,,,,,,,,,,,,,,,,,,,,,,,,,,,United States,North Carolina,Brunswick,,,,,,33.96338911,-78.05986393,,,,,,,,,,,,,,,,en,wpmarinello,10/25/16 15:16,,206,urn:uuid:6bb43316-0ec9-4bc7-a28c-c1284630cc99,http://sernecportal.org/portal/collections/individual/index.php?occid=8530725
8530727,NCU,,,PreservedSpecimen,aee6bf78-1fca-4d71-bade-f30fcae4f3f6,NCU00075779,491439,Plantae,Magnoliophyta,,Poales,Poaceae,Andropogon virginicus,48572,L.,Andropogon,virginicus,,,,,,,,,,,,,,,,,,,,,,,,,,,,,,,,,,,,United States,North Carolina,Carteret,,,,,,34.8327128,-76.67067659,,,,,,,,,,,,,,,,en,wpmarinello,10/25/16 15:16,,206,urn:uuid:aee6bf78-1fca-4d71-bade-f30fcae4f3f6,http://sernecportal.org/portal/collections/individual/index.php?occid=8530727
8530729,NCU,,,PreservedSpecimen,59cfddde-447b-49d6-a00f-4aaabd51e87e,NCU00075780,532711,Plantae,Magnoliophyta,,Poales,Poaceae,Andropogon virginicus,48572,L.,Andropogon,virginicus,,,,,,,,,,,,,,,,,,,,,,,,,,,,,,,,,,,,United States,North Carolina,Carteret,,,,,,34.8327128,-76.67067659,,,,,,,,,,,,,,,,en,wpmarinello,10/25/16 15:16,,206,urn:uuid:59cfddde-447b-49d6-a00f-4aaabd51e87e,http://sernecportal.org/portal/collections/individual/index.php?occid=8530729
8530733,NCU,,,PreservedSpecimen,16e5d3b5-756a-4baf-82d7-d85fd701d483,NCU00075784,520365,Plantae,Magnoliophyta,,Poales,Poaceae,Andropogon virginicus,48572,L.,Andropogon,virginicus,,,,,,,,,,,,,,,,,,,,,,,,,,,,,,,,,,,,United States,North Carolina,Davidson,,,,,,35.79316478,-80.21274137,,,,,,,,,,,,,,,,en,wpmarinello,10/25/16 15:16,,206,urn:uuid:16e5d3b5-756a-4baf-82d7-d85fd701d483,http://sernecportal.org/portal/collections/individual/index.php?occid=8530733
8530737,NCU,,,PreservedSpecimen,a08cbf59-d2ed-425c-b9ff-31f3b282f5a3,NCU00075785,519721,Plantae,Magnoliophyta,,Poales,Poaceae,Andropogon virginicus,48572,L.,Andropogon,virginicus,,,,,,,,,,,,,,,,,,,,,,,,,,,,,,,,,,,,United States,North Carolina,Davidson,,,,,,35.79316478,-80.21274137,,,,,,,,,,,,,,,,en,wpmarinello,10/25/16 15:16,,206,urn:uuid:a08cbf59-d2ed-425c-b9ff-31f3b282f5a3,http://sernecportal.org/portal/collections/individual/index.php?occid=8530737
8530739,NCU,,,PreservedSpecimen,0e613cc7-ec98-4700-afd6-2c1df9535edf,NCU00075786,520302,Plantae,Magnoliophyta,,Poales,Poaceae,Andropogon virginicus,48572,L.,Andropogon,virginicus,,,,,,,,,,,,,,,,,,,,,,,,,,,,,,,,,,,,United States,North Carolina,Davidson,,,,,,35.79316478,-80.21274137,,,,,,,,,,,,,,,,en,wpmarinello,10/25/16 15:16,,206,urn:uuid:0e613cc7-ec98-4700-afd6-2c1df9535edf,http://sernecportal.org/portal/collections/individual/index.php?occid=8530739
8530741,NCU,,,PreservedSpecimen,44c4c413-2f98-437d-9b52-9f0cd71be2b5,NCU00075787,520303,Plantae,Magnoliophyta,,Poales,Poaceae,Andropogon virginicus,48572,L.,Andropogon,virginicus,,,,,,,,,,,,,,,,,,,,,,,,,,,,,,,,,,,,United States,North Carolina,Davidson,,,,,,35.79316478,-80.21274137,,,,,,,,,,,,,,,,en,wpmarinello,10/25/16 15:16,,206,urn:uuid:44c4c413-2f98-437d-9b52-9f0cd71be2b5,http://sernecportal.org/portal/collections/individual/index.php?occid=8530741
8530743,NCU,,,PreservedSpecimen,a2086b8d-dbbd-445b-b778-d15af9cffd7a,NCU00075614,405091,Plantae,Magnoliophyta,,Poales,Poaceae,Andropogon virginicus,48572,L.,Andropogon,virginicus,,,,,,,,,,,,,,,,,,,,,,,,,,,,,,,,,,,,United States,North Carolina,,,,,,,,,,,,,,,,,,,,,,,,en,wpmarinello,10/25/16 15:16,,206,urn:uuid:a2086b8d-dbbd-445b-b778-d15af9cffd7a,http://sernecportal.org/portal/collections/individual/index.php?occid=8530743
8530745,NCU,,,PreservedSpecimen,efe13f57-91cb-41a7-94c4-5791e2281636,NCU00075788,520587,Plantae,Magnoliophyta,,Poales,Poaceae,Andropogon virginicus,48572,L.,Andropogon,virginicus,,,,,,,,,,,,,,,,,,,,,,,,,,,,,,,,,,,,United States,North Carolina,Davidson,,,,,,35.79316478,-80.21274137,,,,,,,,,,,,,,,,en,wpmarinello,10/25/16 15:16,,206,urn:uuid:efe13f57-91cb-41a7-94c4-5791e2281636,http://sernecportal.org/portal/collections/individual/index.php?occid=8530745
8530746,NCU,,,PreservedSpecimen,4a342e8d-5c77-4d65-a93e-ed78a9099f2a,NCU00075789,520586,Plantae,Magnoliophyta,,Poales,Poaceae,Andropogon virginicus,48572,L.,Andropogon,virginicus,,,,,,,,,,,,,,,,,,,,,,,,,,,,,,,,,,,,United States,North Carolina,Davidson,,,,,,35.79316478,-80.21274137,,,,,,,,,,,,,,,,en,wpmarinello,10/25/16 15:16,,206,urn:uuid:4a342e8d-5c77-4d65-a93e-ed78a9099f2a,http://sernecportal.org/portal/collections/individual/index.php?occid=8530746
8530749,NCU,,,PreservedSpecimen,1adbafba-0e1e-4629-80a0-481ccd208286,NCU00074585,149425,Plantae,Magnoliophyta,,Poales,Poaceae,Andropogon virginicus,48572,L.,Andropogon,virginicus,,,,,,,,,,,,,,,,,,,,,,,,,,,,,,,,,,,,United States,North Carolina,Harnett,,,,,,35.36869989,-78.86928141,,,,,,,,,,,,,,,,en,wpmarinello,10/25/16 15:16,,206,urn:uuid:1adbafba-0e1e-4629-80a0-481ccd208286,http://sernecportal.org/portal/collections/individual/index.php?occid=8530749
8530751,NCU,,,PreservedSpecimen,95a2ac29-67c6-42a7-b900-f1bfaad9ac0b,NCU00075790,531012,Plantae,Magnoliophyta,,Poales,Poaceae,Andropogon virginicus,48572,L.,Andropogon,virginicus,,,,,,,,,,,,,,,,,,,,,,,,,,,,,,,,,,,,United States,North Carolina,Hyde,,,,,,35.53180783,-76.24849083,,,,,,,,,,,,,,,,en,wpmarinello,10/25/16 15:16,,206,urn:uuid:95a2ac29-67c6-42a7-b900-f1bfaad9ac0b,http://sernecportal.org/portal/collections/individual/index.php?occid=8530751
8530754,NCU,,,PreservedSpecimen,aa52e2b4-5b54-4e19-9d56-0aaeed731bd0,NCU00115405,493150,Plantae,Magnoliophyta,,Poales,Poaceae,Andropogon virginicus,48572,L.,Andropogon,virginicus,,,,,,,,,,,,,,,,,,,,,,,,,,,,,,,,,,,,United States,North Carolina,Hyde,,,,,,35.53180783,-76.24849083,,,,,,,,,,,,,,,,en,wpmarinello,10/25/16 15:16,,206,urn:uuid:aa52e2b4-5b54-4e19-9d56-0aaeed731bd0,http://sernecportal.org/portal/collections/individual/index.php?occid=8530754
8530756,NCU,,,PreservedSpecimen,7a51abf2-d0a0-42c3-9957-3ddd76ae8b8a,NCU00136825,609760,Plantae,Magnoliophyta,,Poales,Poaceae,Andropogon virginicus,48572,L.,Andropogon,virginicus,,,,,,,,,,,,,,,,,,,,,,,,,,,,,,,,,,,,United States,North Carolina,Lincoln,,,,,,35.48618443,-81.22388615,,,,,,,,,,,,,,,,en,wpmarinello,10/25/16 15:16,,206,urn:uuid:7a51abf2-d0a0-42c3-9957-3ddd76ae8b8a,http://sernecportal.org/portal/collections/individual/index.php?occid=8530756
8530765,NCU,,,PreservedSpecimen,ebb8414e-1325-45c4-82ff-22793fa7cadc,NCU00032832,573260,Plantae,Magnoliophyta,,Poales,Poaceae,Andropogon virginicus,48572,L.,Andropogon,virginicus,,,,,,,,,,,,,,,,,,,,,,,,,,,,,,,,,,,,United States,North Carolina,Onslow,,,,,,34.73742112,-77.43415464,,,,,,,,,,,,,,,,en,wpmarinello,10/25/16 15:16,,206,urn:uuid:ebb8414e-1325-45c4-82ff-22793fa7cadc,http://sernecportal.org/portal/collections/individual/index.php?occid=8530765
8530766,NCU,,,PreservedSpecimen,23b8ef2f-3843-432e-a9a6-acc9e23892e2,NCU00168189,581441,Plantae,Magnoliophyta,,Poales,Poaceae,Andropogon virginicus,48572,L.,Andropogon,virginicus,,,,,,,,,,,,,,,,,,,,,,,,,,,,,,,,,,,,United States,North Carolina,Orange,,,,,,36.06144985,-79.12054743,,,,,,,,,,,,,,,,en,wpmarinello,10/25/16 15:16,,206,urn:uuid:23b8ef2f-3843-432e-a9a6-acc9e23892e2,http://sernecportal.org/portal/collections/individual/index.php?occid=8530766
8530768,NCU,,,PreservedSpecimen,17c39caf-d3e7-4ab2-ae12-9f154428aff8,NCU00028781,572861,Plantae,Magnoliophyta,,Poales,Poaceae,Andropogon virginicus,48572,L.,Andropogon,virginicus,,,,,,,,,,,,,,,,,,,,,,,,,,,,,,,,,,,,United States,North Carolina,Pender,,,,,,34.52545547,-77.90702984,,,,,,,,,,,,,,,,en,wpmarinello,10/25/16 15:16,,206,urn:uuid:17c39caf-d3e7-4ab2-ae12-9f154428aff8,http://sernecportal.org/portal/collections/individual/index.php?occid=8530768
8530770,NCU,,,PreservedSpecimen,5e97f767-03ed-44a0-b296-539dffb5562f,NCU00112691,588100,Plantae,Magnoliophyta,,Poales,Poaceae,Andropogon virginicus,48572,L.,Andropogon,virginicus,,,,,,,,,,,,,,,,,,,,,,,,,,,,,,,,,,,,United States,North Carolina,Pender,,,,,,34.52545547,-77.90702984,,,,,,,,,,,,,,,,en,wpmarinello,10/25/16 15:16,,206,urn:uuid:5e97f767-03ed-44a0-b296-539dffb5562f,http://sernecportal.org/portal/collections/individual/index.php?occid=8530770
